"text","cmp_code","eu_code"
"És per tot el que s’ha exposat, que Convergència proposa crear una Comissió de Treball en el Congrés dels Diputats sobre la qüestió catalana, amb l’objectiu concret d’abordar els aspectes següents:","301",NA
"A. Elaboració d’un diagnòstic contrastat sobre el compliment i el desenvolupament de l’autonomia política catalana, a partir dels fets contrastables especialment en els darrers 10 anys (de l’Estatut d’Autonomia de 2006 fins ara)","301",NA
"B. Anàlisi de les possibilitats i alternatives per un referèndum o una consulta sobre el futur polític de Catalunya.","301",NA
"Amb disposició per abordar aspectes relatius a la pregunta, la data, el quòrum, o el marc legal més adequat.","301",NA
"C. Proposta de conclusions abans de finals de 2016 per poder ser votades en sessió plenària al Congrés dels Diputats.","301",NA
"En la proposta de Convergència a les demés forces, els signants de la proposta no queden condicionats sobre les respectives posicions legítimes respecte a la qüestió catalana, més enllà d’actuar lleialment pel bon curs de la constitució i funcionament de l’esmentada Comissió de Treball que es comprometen a impulsar.","301",NA
"BLOC 3: CATALUNYA, NOU ESTAT D’EUROPA. EL PAÍS QUE ESTEM CONSTRUINT","H",NA
"3.1 Un nou estat del benestar per a tothom i que inverteixi en el futur","H",NA
"3.1.1. L’oportunitat de construir un nou estat del benestar","H",NA
"Catalunya està afrontant els impactes d’una crisi sense precedents.","408",NA
"Malgrat els indicis de recuperació econòmica, la taxa d’atur segueix situada en nivells inacceptables, un 17,4% a Catalunya i el 21% a Espanya, el doble de la UE;","701",NA
"i malgrat l’acció pública, via transferències socials, quasi un 21% de la població es troba en situació de risc de pobresa o d’exclusió social, més de 3 punts per sobre de la mitjana de la UE-28.","504",NA
"El nostre objectiu és fer progressar l’estat del benestar a Catalunya perquè sigui homologable al d’aquells països europeus que el tenen més desenvolupat.","504",NA
"Per aconseguir-ho, en els darrers anys s’ha fet un important esforç pressupostari, el qual ha suposat que el 72% del pressupost es destini als àmbits socials, però necessitem més recursos que avui no tenim i que l’Estat ens retalla.","504",NA
"Segons l’Institut d’Estadística de Catalunya, la inversió en protecció social sobre el PIB català és del 22,3%, mentre que la mitjana comparada amb el conjunt d’Europa (UE-28), es situa en el 29,7%.","504",NA
"Aquest és el recorregut pressupostari de millora que tenim en aquest àmbit.","504",NA
"Malgrat que en prestacions d’atur, invalidesa i exclusió social podem igualar o superar la mitjana UE-28, el necessari recorregut a l’alça del nostre sistema de benestar requereix un augment de la inversió social sobretot en polítiques de protecció a les famílies, als infants i als joves.","504",NA
"Sens dubte, Catalunya genera prou recursos en forma de renda i impostos per disposar d’un potencial d’inversió molt més gran en cohesió social i desenvolupament dels seus serveis de protecció i benestar.","504",NA
"En aquest sentit, l’estratègia de futur requereix potenciar les polítiques inversores en l’àmbit de la redistribució de les oportunitats, com ara l’educació i la formació professional,","506",NA
"i polítiques preventives en matèria de salut, pobresa i desigualtats.","504",NA
"L’agenda nacional i l’agenda social són indestriables.","504",NA
"Un dels principals motius pels quals volem que Catalunya esdevingui un Estat és per consolidar el model social europeu i garantir el benestar per als catalans i catalanes d’avui i per als de demà.","504",NA
"Viure millor és l’objectiu principal de poder disposar de les eines d’un Estat.","301",NA
"La voluntat de construir un nou Estat és perquè Catalunya tingui el futur que desitgem.","301",NA
"Per disposar de més eines a fi de consolidar la sortida de la crisi; una crisi que ha tingut uns greus efectes econòmics i especialment socials.","410",NA
"Per continuar consolidant la creació de nous llocs de treball.","701",NA
"Per garantir l’accés universal, la qualitat i el finançament públic de la sanitat i l’educació.","504",NA
"Per donar un bon futur als nostres joves i a la gent gran.","504",NA
"Aquest futur requereix que disposem dels nostres recursos i prenguem les nostres pròpies decisions.","301",NA
"Si Catalunya esdevé un Estat, podrà desenvolupar plenament el seu potencial com a país.","301",NA
"L’objectiu és situar-nos en una posició millor, en tots els aspectes, de la que tenim actualment.","301",NA
"En aquest sentit, mentre això no es materialitzi i mentre no disposem dels nostres recursos i prenguem les nostres pròpies decisions, a les Corts Generals treballarem des de la perspectiva social en una doble direcció: per facilitar el trànsit cap la consecució d’un nou Estat per a Catalunya","301",NA
"i, a la vegada, per avançar en la reducció de les desigualtats, en l’increment de la cohesió social, en la garantia de la igualtat d’oportunitats, en la millora del benestar i en l’atenció de les situacions d’urgència social de la societat catalana durant aquest període transitori.","504",NA
"3.1.2. Reduir les desigualtats com a garantia de creixement sostenible i estable. Garantir que ningú no es quedi enrere i eixamplar les classes mitjanes","H",NA
"El nivell de benestar d’un país depèn de la seva capacitat per generar riquesa i de la seva habilitat per distribuir-la.","410",NA
"Si les desigualtats són grans, la cohesió social perilla, mentre que si les desigualtats es redueixen, augmenta la cohesió social i millora el benestar.","606.1",NA
"Més cohesió social és més progrés.","606.1",NA
"Nombrosos estudis demostren la correlació positiva entre més igualtat en la distribució de la renda i més sostenibilitat del creixement econòmic.","503",NA
"És a dir, les societats amb menys desigualtats són les que gaudeixen de menor conflictivitat social (homicidis, població reclusa, violència a l’escola...); disposen de millor salut (millors resultats en indicadors com ara l’esperança de vida i els nivells d’obesitat, addiccions i drogodependències, etc.); ofereixen més oportunitats per a tothom (mobilitat i ascens social, igualtat d’oportunitats, millor rendiment escolar...).","503",NA
"En definitiva, posseeixen un clima social més estable, amb nivells de confiança, de seguretat i de coresponsabilitat més elevats.","606.1",NA
"Són societats amb millor benestar i cohesió social.","606.1",NA
"Un ràpid augment de les desigualtats, com el que s’ha produït en els darrers anys, deteriora la qualitat democràtica i institucional, a la vegada que afecta negativament el funcionament de la activitat econòmica i el creixement a causa de l’augment de les situacions d’exclusió.","503",NA
"Per contra, les societats amb menys desigualtats i més cohesionades, solen comptar amb ciutadans implicats, més identificats i participatius institucionalment, dels quals s’aprofita més el talent.","606.1",NA
"Tenen dinàmiques més eficients als mercats i són també més competitives.","410",NA
"Són societats constituïdes per una àmplia classe mitjana que contribueix a l’estabilitat i al creixement econòmic, que genera confiança i que legitima les institucions.","704",NA
"La desigualtat sovint és analitzada des de l’òptica de les diferències de renda, però s’ha d’analitzar també des de la perspectiva generacional.","503",NA
"Cal que la política social destini més recursos i més esforços a protegir, atendre i tenir cura els infants i joves.","504",NA
"Són polítiques que, potser, semblen tenir poc impacte a curt termini, però tenen una importància cabdal en la reducció de les desigualtats en el llarg termini.","504",NA
"Convergencia treballarà molt prioritàriament per combatre el creixement de la pobresa infantil, fenomen que pot dur a situacions cròniques de vulnerabilitat.","504",NA
"En definitiva: si l’augment de les desigualtats deriva de la pèrdua de poder adquisitiu de les classes mitjanes, de l’augment del nombre de persones en situació d’exclusió i del fet que any rere any uns pocs tenen un percentatge cada cop més gran de la riquesa del país, l’antídot està en propiciar l’augment de les classes mitjanes, de manera que siguin menys els extrems i, molt particularment, siguin menys les persones en situació i en risc d’exclusió social.","503",NA
"Convergència està compromesa en la protecció i enfortiment dels drets econòmics, socials i culturals de les persones, amb especial atenció per als grups en situació d’especial vulnerabilitat i en particular en aquests anys de crisis econòmica.","503",NA
"En la desena legislatura, el Govern estatal del PP va centrar bona part de la seva política d’austeritat en ofegar econòmicament i retallar els recursos destinats a les comunitats autònomes i, indirectament, a les classes mitjanes i baixes.","305.1",NA
"Ens ha retallat transferències com el Plan Concertado, transferències per l’atenció a les situacions de dependència, per l’atenció a les famílies, per la integració de la població immigrada, per l’atenció dels joves i pel finançament dels programes i fons de naturalesa sanitària, entre d’altres; mesures que han afectat un gruix molt significatiu de població amb rendes mitjanes i baixes.","504",NA
"Cal revertir aquesta situació amb urgència.","504",NA
"3.1.3 Per un nou contracte social i un contracte generacional","H",NA
"Els impactes negatius de la recessió s’han distribuït de manera desigual entre la població.","503",NA
"S’ha incrementat la precarietat laboral dels joves i dels treballadors amb menys qualificació;","701",NA
"ha augmentat de forma molt important l’atur de llarga durada;","701",NA
"s’ha empobrit la classe mitjana, de la qual els infants són els més perjudicats,","704",NA
"i s’ha incrementat el volum de persones i famílies que no tenen cap tipus d’ingrés ni de cobertura social.","504",NA
"Els desnonaments i les dificultats d’accés a l’habitatge han accentuat les situacions d’exclusió.","504",NA
"Alguns àmbits que requereixen una atenció singular, i que abans de la crisi ja rebien una atenció insuficient com ara l’atenció a la dependència, la promoció de l’autonomia personal o l’ajuda a la discapacitat, han anat encara més enrere en aquests anys.","504",NA
"I, fins i tot, aquelles persones que han pogut mantenir-se i conservar l’ocupació, sovint han vist reduït el seu poder adquisitiu.","504",NA
"Especialment, les famílies amb infants o persones en situació de dependència a càrrec.","504",NA
"Ens cal avançar cap a un nou contracte social capaç de fer front a temes tan bàsics —i avui no resolts— com la lluita contra la pobresa, la inclusió social, l’accés dels joves a ocupacions estables, l’accés de les persones en situació de vulnerabilitat social a treballs dignes, el suport a les famílies amb fills o la garantia d’un habitatge digne a qui en tingui necessitat.","504",NA
"Un nou contracte social que permeti dinamitzar i donar finançament suficient a totes aquelles polítiques que tenim a mig construir: l’atenció a la dependència, la promoció a l’autonomia personal i l’atenció a la discapacitat, l’atenció a la immigració i a l’asil, o la consideració plena del tercer sector com un actor important i d’intensa col·laboració amb el sector públic en finalitats d’interès social.","504",NA
"Hem d’avançar, també, cap a un contracte generacional equilibrat.","504",NA
"Que sigui capaç de garantir les pensions actuals i futures a les persones més grans i, alhora, oferir futurs esperançadors als més joves.","504",NA
"Aquest és el futur que volem construir a Catalunya.","504",NA
"Avui, però, molts dels instruments necessaris per fer-ho continuen en mans de l’Estat, qui, a més, ni fa ni deixa fer, tal com ho demostren els continuats recursos que ha plantejat contra les mesures adoptades per la Generalitat per donar respostes a la pobresa energètica o per aturar els desnonaments.","301",NA
"Ens cal, durant el període de transició, revertir les polítiques errònies i establir prioritats per garantir el benestar.","504",NA
"Durant aquesta etapa defensarem: la necessitat de que a Catalunya tinguem eines suficients per fer front a les emergències socials, als desnonaments, a la pobresa infantil, a la pobresa energètica,","504",NA
"i per defensar i garantir la igualtat.","503",NA
"Entre d’altres, prioritzarem: Lluitar contra la pobresa,","504",NA
"fer efectiva la inclusió social","504",NA
"i garantir el treball digne","701",NA
"• Incrementarem el salari mínim interprofessional fins a aconseguir l’objectiu establert a la Carta Social Europea de situar-lo en el 60% del salari mitjà (aproximadament uns 1.000 €/ mes) al llarg de la Legislatura. •","412",NA
"Impulsarem un acord, entre els interlocutors socials, per adoptar una estratègia que tingui per objectiu evitar l’existència de “treballadors pobres” —aquells que, tot i treballar, necessiten ajuts per arribar a final de mes—","701",NA
"i la reducció de la “bretxa salarial” de gènere.","503",NA
"Reforçarem la negociació col·lectiva.","701",NA
"•",NA,NA
"Recuperarem i millorarem la protecció de les persones en situació d’atur, especialment quan aquest és de llarga durada i quan afecta famílies amb infants o amb persones en situació de dependència a càrrec.","504",NA
"Impulsarem la creació d’una prestació d’ingressos mínims en l’àmbit de protecció de la seguretat social, prestació destinada a garantir la percepció d’uns recursos mínims per a totes aquelles persones que, podent i volent treballar, no poden fer-ho i que com a conseqüència d’això no poden viure amb dignitat, i als quals els actuals instruments de protecció social no donen resposta.","504",NA
"• Recuperarem els recursos a transferir a les comunitats autònomes destinats a polítiques actives d’ocupació.","301",NA
"Per dinamitzar l’ocupació és imprescindible que la Generalitat disposi dels recursos necessaris per atendre les persones que ho necessiten de manera individualitzada i efectiva.","504",NA
"Recuperarem i incrementarem les dotacions dels Pressupostos Generals de l’Estat per transferir a d’altres administracions per programes de serveis socials i pel finançament de les prestacions bàsiques dels serveis socials d’atenció primària.","504",NA
"• Crearem un Fons per Combatre la Pobresa i l’Exclusió Social, especialment la infantil, que es doti amb recursos recaptats per actuacions contra el frau fiscal i que distribueixi els seus fons entre les comunitats autònomes.","504",NA
"És imprescindible reforçar l’atenció a les famílies en les que cap dels seus membres té feina i ingressos.","504",NA
"• Destinarem més recursos a reforçar els programes de rendes mínimes que ens permeti, a Catalunya, posar les bases per a una renda garantida de ciutadania.","504",NA
"La distribució d’aquests fons ha de tenir en compte les diferències territorials quant a cost de la vida.","504",NA
"• Restablirem les competències de l’Administració local en matèria de serveis socials, derogant les disposicions de la Llei 27/2013, de 27 de desembre, de racionalització i sostenibilitat de l’Administració local, les quals estableixen una nova distribució de les competències en matèria de serveis socials contràries a l’autonomia local, contraries a l’exercici de les competències de les comunitats autònomes en aquests àmbits i contraries a l’exercici d’una atenció propera al. •","504",NA
"Transferirem a la Generalitat de Catalunya la gestió, el seguiment i l’avaluació del Fons d’Ajut Europeu per a les Persones més Desafavorides (FEAD 2014-2020).","301",NA
"• Modificarem i reforçarem l’aportació estatal a les comunitats autònomes del Pla de desenvolupament del poble gitano, per tal que permeti donar suport a les iniciatives vinculades amb la integració i la cohesió de la comunitat gitana. •","504",NA
"Crearem un fons estatal territorialitzat entre les comunitats autònomes per atendre l’especial situació de les persones sense llar.","504",NA
"•",NA,NA
"Reclamarem el 100% del finançament de les despeses de gestió d’aquelles prestacions que l’Estat ha delegat a la Generalitat de Catalunya (com ara les dues modalitats de pensió no contributiva).","504",NA
"•",NA,NA
"Promourem l’actualització de l’Indicador Público de Renta de Efectos Múltiples (IPREM), que s’ha mantingut fix en els darrers cinc anys, perquè estigui en consonància amb els llindars de risc de pobresa de cada comunitat autònoma, adequant-lo al cost de la vida actual, el qual ha canviat.","504",NA
"•",NA,NA
"Estendrem l’aplicació d’un tipus reduït d’IVA per als serveis energètics de primera necessitat (electricitat, aigua o gas).","504",NA
"•",NA,NA
"Impulsarem els canvis legislatius necessaris per tal que els ajuts d’urgència destinats a la compra de medicaments, al pagament de rebuts de subministraments, al manteniment de l’habitatge o a menjadors escolars no tributin.","504",NA
"• Demanarem la ratificació, per part de l’Estat, de la Carta Social Europea revisada el 1996 i del protocol addicional del 1998, amb l’objectiu de fer realitat les garanties contemplades i en especial, sobre la dignitat de tota persona.","201.2",NA
"Suport a les famílies amb nens","H",NA
"Com hem assenyalat, urgeix lluitar de manera especial contra la pobresa infantil i invertir en el futur d’infants i joves, cal dedicar-hi més esforços i augmentar el suport a les famílies.","504",NA
"Tenim l’objectiu d’incrementar el percentatge del PIB destinat a la família, fins arribar a la mitjana europea (2,2% UE-28).","504",NA
"L’ Estat espanyol és un dels estats europeus que menys ajuts atorga a la criança de fills.","504",NA
"Establirem una prestació universal per a la criança dels fills o menors de 18 anys a càrrec, finançada per la seguretat social, com a prestació d’ajut a la família i per al reequilibrament demogràfic.","504",NA
"A curt termini i per avançar cap aquest objectiu: • Multiplicarem per 4 la quantia de la prestació econòmica de la seguretat social per fills o menors acollits a càrrec dels 24 euros/mes actuals a 100 euros/mes per fill/filla,","504",NA
"i elevarem els topalls màxims d’ingressos familiars que donen dret a rebre la prestació, des dels 11.868€/any vigent fins als 25.400 euros/any.","504",NA
"L’objectiu és que sigui un veritable ajut per a la criança dels fills i que en un futur tingui caràcter universal.","504",NA
"Incrementarem, també en la mateixa proporció, l’import de la prestació en els supòsits de famílies nombroses, monoparentals i famílies amb fills o menors acollits amb discapacitat.","504",NA
"• Incrementarem i ampliarem la deducció per maternitat establerta a la Llei 35/2006, de 28 de novembre, de l’impost sobre la renda de les persones físiques i de modificació parcial de les lleis dels imposts de societats, sobre la renda de no residents i sobre el patrimoni.","504",NA
"• Incrementarem la minoració de 1.200 euros anuals per cada fill de la quota de l’IRPF, a la que tenen dret les dones amb fills menors de 3 anys que realitzen una activitat per compte propi o aliena, fins a 2.400 euros anuals en el cas de menors de 3 anys.","504",NA
"• Ampliarem la deducció a aquelles dones amb fills d’entre 3 i 18 anys, per import d’1.200 euros anuals per fill. •","504",NA
"Reclamarem que el Fons espanyol per a la realització de projectes socials de suport a la família i la infància estigui degudament dotat d’acord amb el seu objectiu, i que es modifiquin els criteris de distribució, per tal d’adequar-lo a la realitat de la població infantil en risc de pobresa de cada comunitat autònoma.","504",NA
"•",NA,NA
"Defensarem davant el Govern de l’Estat l’exercici de les competències d’adopció internacional de la Generalitat de Catalunya, per continuar garantint la tramitació d’adopcions internacionals a Catalunya d’acord amb la legislació catalana vigent en la matèria, i en coordinació amb la resta d’organismes i entitats competents autonòmiques i estatals.","301",NA
"Derogarem la normativa del PP, que regula aquesta matèria, la qual, al no haver estat desenvolupada ha paralitzat totes les adopcions en curs, les que tramitava Catalunya i les que tramitava l’Estat.. •","301",NA
"Reclamarem al Govern de l’Estat la recuperació de totes les transferències finalistes destinades al Govern de la Generalitat en relació amb els programes de maltractament infantil i de suport a les famílies en situacions especials.","301",NA
"•",NA,NA
"Modificarem la normativa que regula la protecció de les famílies nombroses i monoparentals per ampliar el concepte de família nombrosa","504",NA
"i, alhora, incrementar el suport de l’Administració tant a les famílies nombroses com a les monoparentals, tenint especial consideració respecte de les famílies amb fills menors de tres anys i amb persones amb dependència o amb discapacitat.","504",NA
"•",NA,NA
"Continuarem impulsant l’equiparació de les mesures en matèria de conciliació de la vida personal, familiar i laboral entre l’àmbit laboral públic i privat.","701",NA
"Prioritzarem la conciliació en les estratègies de negociació col·lectiva, i la sol·licitud dels homes dels permisos de paternitat que la llei els reconeix.","701",NA
"•",NA,NA
"Promourem els horaris flexibles i la jornada continuada d’acord amb les necessitats dels treballadors amb fills o d’altres persones a càrrec.","701",NA
"•",NA,NA
"Millorarem la protecció social en relació amb l’exercici dels permisos i llicències per a l’atenció de responsabilitats familiars, tals com l’ampliació de la protecció durant el períodes de maternitat/paternitat, adopció i acolliment, tot eliminant el requisit del període mínim de carència de cotització a la seguretat social.","504",NA
"Inclourem en la protecció els supòsits de risc per embaràs i risc durant la lactància.","504",NA
"•",NA,NA
"Treballarem per avançar en la implantació d’uns horaris més racionals i beneficiosos per als ciutadans, les empreses i les institucions amb l’objectiu d’adaptar-se a les necessitats vitals actuals, amb horaris que permetin conciliar la vida familiar, personal i laboral.","408",NA
"Amb l’objectiu d’augmentar la productivitat i millorar el benestar de la societat.","410",NA
"•",NA,NA
"Avançarem en la regulació de la maternitat subrogada i en la reducció de les dificultats jurídiques específiques associades als acords de subrogació transfronterera, tenint en compte la necessitat del menor de disposar d’uns pares legals i d’un estatus civil clarament definit, i la igualtat i llibertat reproductiva.","604",NA
"Segones oportunitats per a persones vulnerables. Les polítiques socials d’habitatge. La SAREB","H",NA
"Els desnonaments per impagament de préstecs hipotecaris han estat una de les cares més visibles de la crisi.","504",NA
"Són moltes les persones que, a més de perdre l’habitatge, han quedat endeutats de per vida.","504",NA
"La major part d’aquestes persones no podran sortir d’aquesta situació si no es fa una llei de segona oportunitat adequada, atès que l’actual és clarament insuficient per poder fer la dació en pagament de l’habitatge, desfer-se dels deutes i tenir una segona oportunitat per començar de nou.","504",NA
"La crisi ha mostrat, també, les incoherències del mercat de l’habitatge","403",NA
"i de les polítiques d’habitatge a l’Estat espanyol.","504",NA
"Un enorme mercat d’habitatge de compra, i un reduït mercat de lloguer i unes mínimes polítiques socials d’habitatge per a joves, per a gent gran o per a famílies i persones en situació de vulnerabilitat.","504",NA
"Aquesta realitat ha estat un dels aspectes rellevants en l’augment de les desigualtats.","504",NA
"Quan Catalunya disposi d’un Estat, podrà fer-ho millor.","301",NA
"Tenim el repte col·lectiu de disminuir l’actual ràtio del cost d’habitatge en relació amb la renda disponible de les famílies.","504",NA
"La política d’habitatge ha de preveure noves formes de tinença i tendir cap al valor d’ús enlloc de fer-ho cap al valor econòmic, fomentant el creixement del parc de lloguer i, especialment, el parc públic.","504",NA
"Les polítiques d’habitatge han d’anar dirigides a una intervenció pública selectiva i efectiva sobre els mercats, que tingui com a objectiu l’adequació del preu de l’habitatge a la capacitat de renda de les famílies.","412",NA
"El lloguer ha de ser el règim de tinença prioritari de l’habitatge protegit de promoció privada, i el dret de superfície i el lloguer els règims de tinença prioritaris de les promocions públiques, garantint la propietat pública del parc per donar servei a més d’una generació.","504",NA
"Durant el període de transició cal adoptar amb celeritat mesures de política d’habitatge i contra els desnonaments, que permetin reconduir la situació de moltes persones i famílies amenaçades per la pèrdua de l’habitatge o per les dificultats a accedir-hi.","504",NA
"L’Estat avui disposa d’instruments que no utilitza, com per exemple la SAREB, una societat propietària de centenars de pisos buits, procedents dels desnonaments, dels quals només una petita part s’ha posat a disposició d’ajuntaments i de la Generalitat.","504",NA
