"text","cmp_code","eu_code"
"PROGRAMA ELECTORAL FETS X CATALUNYA PREÀMBUL CONVERGÈNCIA DAVANT EL #26J INTRODUCCIÓ #26J, DE LA POST-AUTONOMÍA A LA PRE-INDEPENDÈNCIA. DEFENSAR CATALUNYA I LA GENT QUE HI VIU 1. Donar resposta política a un mandat democràtic 2. D’on venim Què hem fet Què volem fer (del 10J de 2010 al 26J de 2016) 3. Per què cal tenir força a les eleccions del 26J? cdcp CATALUNYA FETS V www.convergencia.cat BLOC 1 ELS GREUGES DE L'ESTAT AMB CATALUNYA I AMB LA DEMOCRÀCIA 1.  Una ofensiva premeditada: la destrucció de l’autogovern  2. Ofec de les institucions catalanes : • El dèficit fiscal de Catalunya amb l’Estat (balances fiscals) • La desequilibrada distribució dels objectius de dèficit • L’augment de la pressió fiscal estatal (IVA, IRPF, societats, impostos especials, etc.). Cap retorn a Catalunya • La no-consideració del cost de la vida com a font de desigualtats • El sistema de finançament 3.Incompliments  4.Mesures recentralitzadores  5.X Legislatura (2011-2015): un atac a la democràcia  6. XIa Legislatura (gener-maig 2016): un fracàs de la democràcia espanyola cdcp CATALUNYA FETS V www.convergencia.cat BLOC 2 EL FULL DE RUTA CAP A LA INDEPENDÈNCIA. L’AGENDA DE NEGOCIACIÓ ESPANYOLA 1. El Parlament marcarà la via catalana cap a l’Estat propi 2. Suport a l’agenda del Govern de la Generalitat 3. La defensa dels drets de la societat catalana davant les institucions de l’Estat espanyol 4. Posicionament de l’Estat sobre la qüestió catalana BLOC 3 CATALUNYA, NOU ESTAT D’EUROPA. EL PAÍS QUE ESTEM CONSTRUINT 3.1. Un nou estat del benestar per a tothom i que inverteixi en el futur 3.1.1 L’oportunitat de construir un nou estat del benestar- El dèficit fiscal de Catalunya amb l’Estat (balances fiscals) 3.1.2 Reduir les desigualtats com a garantia de creixement sostenible i estable. Eixamplar les classes mitjanesespecials, 3.1.3 Per un nou contracte social i un contracte generacional : • Lluitar contra la pobresa, fer efectiva la inclusió social i garantir el treball digne  • Suport a les famílies amb nens • Segones oportunitats per a persones vulnerables. Les polítiques socials d’habitatge. La SAREB  • Assegurar els subministraments bàsics als consumidors vulnerables  • Polítiques de joventut. Present i futur. • Pensions: recuperar el poder adquisitiu i millorar les de viduïtat  • Persones en situació de dependència, promoció de l’autonomia personal i gent gran • Atenció a les persones amb discapacitat: igualtat d’oportunitats • Migracions: nou enfocament  • Suport i col·laboració amb el tercer sector social i el voluntariat i impuls a la innovació social  • Reforçar els instruments de col·laboració privada en activitats d’interès social (mecenatge i RSE)  3.1.3 Enfortir els pilars de la cohesió social. Reactivar l’ascensor social • Salut: retorn a la universalització i millora del finançament de la sanitat  • Ensenyament. En defensa del model educatiu català  • Enfortir els ensenyaments postobligatoris: universitats i formació professional  • Igualtat de gènere i lluita contra la violència masclista  • Igualtat amb els col·lectius LGTBI i altres col·lectius discriminats • Cultura i llengua. Molt per fer. Refer el que s’ha volgut destruir  • Esport. La visió catalana  3.2. Una economia dinàmica, sostenible i al servei de les persones 3.2.1 Més recursos per a Catalunya des del primer dia de la legislatura 3.2.2 Ocupació: creixement i més polítiques per a la creació de llocs de treball  3.2.3 Una política econòmica per a un creixement de llarg termini, innovador i sostenible 3.2.4 Política fiscal  3.2.5 Política financera 3.2.6 Política energètica: per una energia segura, competitiva i sostenible 3.2.7 Les polítiques d’impuls sectorial: agricultura, indústria, comerç, turisme, serveis 3.2.8 Garantir la competitivitat empresarial 3.2.9 Defensa dels interessos de la petita i mitjana empresa i dels emprenedors autònoms 3.2.10 Acord Transatlàntic per al  Comerç  i la Inversió entre Europa i EUA (TTIP) 3.2.11 Unitat de mercat 3.2.12 Les infraestructures de futur: transport, comunicacions, TIC 3.2.13 Compromesos amb un país més saludable, respectuós amb la natura i el medi ambient 3.3. Una administració al servei dels ciutadans 3.3.1 Administració pública i ciutadania. Facilitar la transició 3.3.2 L’Administració de Justícia 3.3.3 Seguretat i defensa 3.3.4 Catalunya i les polítiques europea i exterior cdcp CATALUNYA FETS V www.convergencia.cat 3.3.5 Millorar la cooperació amb el desenvolupament 3.3.6 Donar resposta al problema dels refugiats  3.4. Governança i regeneració democràtica 3.4.1 Millora de la qualitat democràtica 3.4.2 Millora de la transparència, la participació i la rendició de comptes 3.4.3 La lluita contra la corrupció",NA,NA
"PREÀMBUL CONVERGÈNCIA, DAVANT EL #26J Les eleccions del 26 de juny són un fracàs de la política espanyola. No hi ha precedents en democràcies properes sobre la incapacitat de pactar un govern de coalició, com ha succeït a Espanya. S’ha hagut de convocar una segona volta del 20 de desembre perquè els partits no han estat capaços de gestionar la complexitat. I part d’aquest desenllaç ve donat per la incapacitat de donar resposta al fet català. Quan a les forces polítiques espanyoles se’ls planteja un repte polític des de la legitimitat democràtica que donen les urnes només saben obviar-lo, negar-lo o combatre’l judicialment. Des de Convergència enfoquem aquestes eleccions amb el convenciment que, a diferència de l’Estat espanyol, al nostre país ha començat un nou cicle polític. Un cicle que, en paraules del president Puigdemont, ens situa entre la post-autonomia i la pre-independència. Malgrat les dificultats que té el procés polític que estem vivint a terme a Catalunya, és l’únic projecte en positiu que planteja un repte de futur engrescador i que ha estat capaç de mantenir durant anys una forta capacitat de mobilització i d’engrescament col·lectiu. Enfoquem aquestes eleccions amb un bon balanç de servei al país i al procés. Amb lideratge generositat. I amb l’exercici de responsabilitat de qui s’ha posat el país a l’esquena i qui ha lluitat com el que més per salvar l’estat del benestar durant els pitjors anys de la crisi. Ens presentem a aquestes eleccions amb el compromís de defensar Catalunya amb fets, de prioritzar un futur de prosperitat i benestar per a tothom. És per això que volem fer un país nou, per posar-lo al servei de les persones. Per forjar un país on la prioritat sigui la gent. Perquè defensar Catalunya és treballar incansablement per a què tothom tingui feina, és defensar i salvar l’estat del benestar davant una de les crisis més dures que hem patit, és buscar els camins més adequats per construir estructures per bastir un nou estat, és defensar el nostre model educatiu, la nostra llengua i el model sanitari d’èxit referent arreu. Allí on hi hagi un espai per defensar Catalunya, allí estarem els homes i les dones de Convergència.",NA,NA
"INTRODUCCIÓ #26J, DE LA POSTAUTONOMÍA A LA PRE-INDEPENDÈNCIA. DEFENSAR CATALUNYA I LA GENT QUE HI VIU INTRODUCCIÓ: #26J, DE LA POST-AUTONOMÍA A LA PRE-INDEPENDÈNCIA. DEFENSAR CATALUNYA I LA GENT QUE HI VIU Les eleccions del 27 de setembre van definir per primer cop una majoria parlamentària favorable a la independència de Catalunya. El resultat electoral va ser clar: 72 diputats favorables a la independència, 52 en contra i 11 favorables al dret a decidir. El resultat en vots també va ser clar en mostrar els suports que té cadascú: 47,74 % favorables a la independència, 39,17 % en contra, 8,94 % a favor del dret a decidir i 4,15 % cap a forces sense representació parlamentària, vot en blanc i nul. Mai no hi havia hagut un suport electoral tan clar a Catalunya favorable a la independència. Malgrat aquest clar resultat, que legitimava la continuïtat del projecte polític liderat des de l’any 2012 pel President Mas i que havia suposat grans èxits col·lectius com la consulta del 9 de novembre de 2014, la suma de dues intransigències han dificultat el poder tirar endavant amb una voluntat majoritària de situar el país en l’estadi previ a la independència. Per una banda la intransigència del govern del Partit Popular, judicialitzant un projecte polític i democràtic, i per l’altra la de la CUP posant per davant els seus maximalismes ideològics en front de la voluntat serena i sòlida d’una gran majoria de ciutadans d’aquest país. El resultat de les eleccions del 27 S no es podien entendre com un mandat unilateral cap a la independència, però legitimaven de manera clara una majoria parlamentària per iniciar el procés. Ningú no pot negar que existeix una majoria de catalans que volen superar l’actual marc de relacions i encetar el camí cap a un estat propi per a Catalunya. El que de ben segur no avala aquest resultat és el silenci, la manca de resposta democràtica i la nul·la capacitat de diàleg que manifesten les institucions de l’Estat espanyol, encapçales pel Govern espanyol i també pels principals partits de la oposició.",NA,NA
"1. Donar resposta política a un mandat democràtic","H",NA
"Catalunya viu uns moments de gran transcendència política i nacional.","301",NA
"Per primera vegada en molts anys una majoria inapel·lable de catalanes i catalans, mitjançant la força dels seus vots, han donat una majoria al Parlament de Catalunya amb un mandat inequívoc: l’inici del procés de construcció d’un estat propi per a Catalunya.","301",NA
"Les eleccions del proppassat 27 de setembre han marcat un abans i un després en els anhels de molts catalans i catalanes.","301",NA
"Finalment, després de quatre anys de mobilitzacions ciutadanes excepcionals i de molts esforços, els ciutadans de Catalunya han pogut votar i exercir el dret a decidir el futur nacional i polític del seu país.","301",NA
"Unes eleccions convocades després d’un llarg camí transcorregut i no exempt d’entrebancs i dificultats.","301",NA
"Uns comicis convocats com a darrera oportunitat per poder donar sortida a l’anhel d’una majoria molt clara i rotunda d’un país que volia exercir, democràticament i pacíficament, el dret a decidir el seu futur.","301",NA
"Un dret que, tot i comptar amb un ampli suport ciutadà i de la majoria dels diputats del Parlament, ha estat i encara és negat sistemàticament per l’Estat espanyol, que avui continua donant l’esquena al diàleg i a la negociació.","301",NA
"Les eleccions del 27 de setembre van donar finalment al poble de Catalunya l’oportunitat de poder exercir el seu dret a decidir tot atorgant caràcter plebiscitari als seus vots.","301",NA
"Un plebiscit que a hores d’ara ja no és negat per ningú.","301",NA
"Amb una participació històrica del 75 %, els vots han atorgat una majoria absoluta indiscutible als partits favorables a la independència de Catalunya.","301",NA
"Per primera vegada a la història del Parlament de Catalunya hi ha una majoria netament independentista formada per 72 diputats.","301",NA
"Amb aquest resultat electoral, ja ningú no pot parlar de majories silencioses.","301",NA
"Les urnes van parlar i el resultat és clar, rotund i a l’abast de tothom.","301",NA
"La candidatura de Junts pel Sí va obtenir més d’un milió sis-cents mil vots, el màxim nombre de vots que ha obtingut mai una candidatura en unes eleccions al Parlament de Catalunya.","305.1",NA
"El Sí ha guanyat les eleccions, i això és una realitat inqüestionable i inapel·lable.","301",NA
"Tant a Escòcia com al Quebec els respectius referèndums es van convocar després de les victòries electorals del Partit Nacional Escocès (SNP) i del Partit Quebequès, en ambdós casos, amb uns percentatges de vots inferiors als obtinguts per les forces independentistes a Catalunya.","301",NA
"En canvi, l’Estat espanyol ha impedit exercir el dret a decidir quan el suport a la independència arriba gairebé al 48 %.","301",NA
"Així doncs, estem plenament legitimitats.","301",NA
"Tenim un mandat democràtic majoritari i un full de ruta per tal d’iniciar el procés que ha de permetre construir un nou estat i dotar d’una vida millor els catalans i les catalanes.","301",NA
"Tenim a les nostres mans l’oportunitat de donar un futur millor per a Catalunya.","301",NA
"El món ens observa i està amatent a aquest moviment plural i transversal imparable.","301",NA
"Un moviment per a tothom, pacífic, democràtic i que no exclou ningú, que busca amb la mà estesa construir un nou marc de relacions que faci possible un futur millor per als ciutadans de Catalunya; una vida millor.","606.1",NA
"Ara és l’hora de fer realitat el mandat de les urnes i d’oferir el millor de cadascú de nosaltres per fer possible la plenitud política i nacional de Catalunya.","301",NA
"2. D’on venim. Què hem fet. Què volem fer (del 10J de 2010 al 26J de 2016)","H",NA
"La recerca de l’encaix amb Espanya esberlada per la sentència del Tribunal Constitucional sobre l’Estatut","H",NA
"Històricament, les principals formacions polítiques catalanes han treballat per buscar fórmules que fessin possible un encaix còmode de Catalunya amb Espanya.","301",NA
"Aquesta línia d’acció es va refermar amb el pacte polític que va fer possible la transició i l’aprovació, l’any 1978, de la Constitució espanyola.","203",NA
"Aquesta col·laboració lleial tenia un doble objectiu: d’una banda, aconseguir recuperar i consolidar l’autogovern de Catalunya,","301",NA
"i, de l’altra, contribuir al progrés i la modernització d’Espanya.","410",NA
"D’aquesta manera, la transformació d’Espanya cap a un estat modern, tolerant i conscient de la riquesa de la seva diversitat havia de fer possible que Catalunya s’hi integrés amb plena capacitat per poder desenvolupar el seu propi projecte, d’acord amb la seva realitat nacional.","301",NA
"Durant molts anys el catalanisme polític ha treballat en aquesta direcció, col·laborant de manera lleial amb Espanya, contribuint a la seva governabilitat i estabilitat, i donant suport als principals reptes que l’Estat espanyol tenia plantejats.","301",NA
"Des de l’elaboració mateixa de la Constitució espanyola de 1978 fins a la incorporació d’Espanya a la Unió Europea i a l’euro, passant pel manteniment de la solidaritat entre territoris o la garantia de l’estabilitat del seus governs (tant del PSOE com del PP), el catalanisme polític ha estat un exemple de compromís i responsabilitat, amb l’esperança del benefici comú que suposava jugar a favor de la construcció d’una Espanya moderna, democràtica i integrada a Europa.","301",NA
"No hi ha dubte que durant anys aquesta política va obtenir els seus resultats.","301",NA
"L’autogovern de Catalunya va créixer i es va consolidar,","301",NA
"i Espanya va integrar-se plenament a Europa i a la Unió Europea, amb tot el que això comporta.","108",NA
"Tanmateix, en els darrers anys han estat múltiples i evidents els fets que demostren una clara voluntat d’involució per part de l’Estat espanyol.","301",NA
"El Govern amb majoria absoluta del PP entre els anys 2000 i 2004 en fou una primera mostra inequívoca.","305.1",NA
"Posteriorment, les contínues traves al procés d’elaboració de l’Estatut d’Autonomia de Catalunya de 2006 van reafirmar aquesta evidència.","301",NA
"L’Estatut de 2006, que va néixer amb la voluntat de renovar la relació de Catalunya amb Espanya, va ser objecte d’atacs i retallades, amb diferents graus d’intensitat, per part dels dos grans partits estatals.","301",NA
"Com a conseqüència, amb un clar menyspreu per la voluntat del poble de Catalunya, que va aprovar-lo amb el suport de tres quartes parts dels votants, i malgrat el suport majoritari de les Corts espanyoles, l’any 2010 una sentència del Tribunal Constitucional, basant-se en els recursos interposats pel PP i pel Defensor del Pueblo, va amputar les parts fonamentals de l’Estatut.","301",NA
"Això va donar lloc a una reacció històrica de la societat catalana, que es va fer evident el 10 de juliol de 2010, quan els ciutadans de Catalunya van omplir massivament els carrers de Barcelona manifestant-se pacíficament sota el lema “Som una Nació. Nosaltres decidim”.","301",NA
"La sentència del Tribunal Constitucional sobre l’Estatut va liquidar el pacte constitucional de 1978 i va posar fi al període de col·laboració constructiva entre Catalunya i l’Estat espanyol.","301",NA
"D’aquesta manera s’obria una nova etapa en la història política de Catalunya: la transició nacional basada en el dret a decidir del poble de Catalunya.","301",NA
"El dret a decidir: pacte fiscal (2010 - 2012)","H",NA
"La sentència del Tribunal Constitucional sobre l’Estatut d’Autonomia referendat pel poble de Catalunya marca, doncs, un punt d’inflexió molt clar.","301",NA
"Aixeca un mur entre l’Estat espanyol i una gran part de la societat catalana, que se sent exclosa del context constitucional,","204",NA
"i és la constatació que l’Estat espanyol no té cap voluntat d’evolucionar cap a un estat plurinacional.","301",NA
"Aquest mur conduïa inexorablement cap a una nova via: la transició nacional basada en el dret dels ciutadans de Catalunya a decidir lliurement el seu futur.","301",NA
"Tant les consultes populars iniciades l’any 2009 com l’impuls de la societat civil a través d’entitats com l’Assemblea Nacional Catalana, Òmnium Cultural o l’Associació de Municipis per la Independència, donen a aquest procés una projecció des de la base i una dimensió social, pacífica i democràtica.","301",NA
"En aquest sentit, es constata que una de les qüestions que generen un consens més ampli en la societat catalana és la reivindicació d’un model de finançament propi, en la línia del concert econòmic, que posi fi a l’injust dèficit fiscal que pateix Catalunya des de fa dècades.","301",NA
"El mes de juliol de 2012 el Parlament de Catalunya aprova per àmplia majoria la proposta de pacte fiscal en la línia del concert econòmic i avala l’inici d’una negociació bilateral entre els governs català i espanyol.","301",NA
"Recollint aquest encàrrec, el president Artur Mas es reuneix amb el president Mariano Rajoy el 20 de setembre per plantejar-li l’inici d’una negociació en aquesta línia, però el president espanyol rebutja qualsevol negociació de pacte fiscal i de model de finançament propi per a Catalunya.","301",NA
"Paral·lelament, nou dies abans, un milió i mig de persones surten als carrers de Barcelona en la manifestació de l’11 de setembre sota el lema “Catalunya, nou estat d’Europa”.","301",NA
"En aquest context, trencada la via del pacte fiscal que comptava amb un ampli suport parlamentari, la mateixa tardor de 2012 es convoquen eleccions anticipades al Parlament de Catalunya per tal de copsar la veu dels ciutadans en relació amb la necessitat de donar un pas endavant en el procés de transició nacional i l’exercici del dret a decidir.","301",NA
"El dret a decidir: consulta i plebiscit (2012-2015)","H",NA
"El resultat de les eleccions del 25 de novembre fou inequívoc.","301",NA
"Les forces que portaven el dret a decidir en el seu programa van obtenir una majoria aclaparadora.","301",NA
"Amb una participació de gairebé el 70 %, els ciutadans expressaren un clar suport al dret a decidir avalaren l’obertura d’una nova etapa en el procés de transició nacional.","301",NA
"S’impulsà així un procés en què, amb grans majories, amb amplis consensos i amb el màxim compromís democràtic i respecte als marcs legals, Catalunya reclamava poder decidir lliurement el seu futur, poder votar quin ha de ser el seu estatus polític.","301",NA
"És això el que es reclamà en noves grans mobilitzacions al carrer i en diferents declaracions i acords majoritaris del Parlament.","301",NA
"Una d’aquestes resolucions parlamentàries demanava iniciar el diàleg amb el Govern espanyol per fer possible la celebració d’una consulta sobre el futur polític de Catalunya.","301",NA
"Però el president Rajoy, en resposta al nou emplaçament formulat per escrit pel president Artur Mas, va condicionar qualsevol diàleg al marc jurídic donant de facto una nova resposta negativa.","301",NA
"Tanmateix, d’acord amb el marc constitucional, el 8 d’abril de 2014 una delegació del Parlament de Catalunya compareix davant del Congrés dels Diputats per demanar la delegació a la Generalitat de les competències per celebrar un referèndum de manera acordada.","301",NA
"La proposta és rebutjada de forma rotunda amb el vot contrari de 299 diputats.","301",NA
"Una nova via de negociació es tanca.","301",NA
"Per tal de poder oferir una nova via a l’anhel majoritari del poble de Catalunya de ser consultat sobre el seu futur, el 19 de setembre el Parlament de Catalunya aprova la Llei de consultes populars no referendàries i participació ciutadana, avalada pel Consell de Garanties Estatutàries.","301",NA
"D’acord amb aquesta llei, el 27 de setembre es convoca la consulta per al dia 9 de novembre de 2014 amb una pregunta acordada per sis forces polítiques: CDC, ERC, UDC, CUP, ICV i EUiA.","301",NA
"Però dos dies després, a petició del Govern espanyol, el Tribunal Constitucional suspèn cautelarment la llei de consultes aprovada pel Parlament i el decret de convocatòria de la consulta del 9-N.","301",NA
"Davant d’aquestes suspensions, s’organitza un procés participatiu per al 9-N, que gràcies a la feina i el compromís de milers voluntaris i amb l’ajuda de la societat civil, esdevé un èxit rotund, amb més de 2,3 milions de persones que s’expressen a les urnes malgrat les amenaces del Govern i de les institucions de l’Estat.","301",NA
"Amenaces traduïdes posteriorment en fets, a través de les querelles presentades contra el president de la Generalitat, l’aleshores vicepresidenta i la consellera d’Ensenyament.","301",NA
"En conclusió, des de la sentència del Tribunal Constitucional de 2010, la resposta del Govern espanyol a totes les demandes, propostes i mobilitzacions de la societat i les institucions catalanes ha estat una negativa rotunda i reiterada, sense cap mena de pal·liatiu.","301",NA
"Davant d’aquesta reiteració del “no a tot”, l’única opció per poder fer sentir la veu dels ciutadans de Catalunya a les urnes va ser la convocatòria d’unes eleccions ordinàries al Parlament de Catalunya, a les quals les formacions polítiques van donar un caràcter plebiscitari, convertint-les d’aquesta manera en la consulta que l’Estat espanyol havia impedit fer.","301",NA
"El mandat democràtic: de les eleccions del 27S al 26J","H",NA
"Les eleccions al Parlament de Catalunya del proppassat 27 de setembre, d’un caràcter inequívocament plebiscitari, van donar com a resultat una clara majoria de diputats independentistes al Parlament de Catalunya.","301",NA
"Amb una victòria nítida de la candidatura de Junts pel Sí, recau sobre aquesta formació la responsabilitat de formar govern","305.1",NA
"i impulsar el full de ruta cap a la constitució de Catalunya com a estat independent.","301",NA
"Resulta imprescindible, per donar sortida a aquest mandat, la negociació amb l’Estat espanyol, la Unió Europea i la comunitat internacional.","301",NA
"3. Per què cal tenir força a les eleccions del 26J? Perquè o fas política o te la fan","H",NA
"Ara més que mai és el moment de fer política a Madrid.","301",NA
"El Govern espanyol durant aquests darrers quatre anys ha laminat conscientment les competències de la Generalitat de Catalunya tant com ha pogut.","301",NA
"Hem estat objecte d’un procés constant i persistent de recentralització de les nostres competències.","301",NA
"Hem sofert un capítol més del llarg reguitzell d’incompliments, ofecs i menysteniments de l’Estat espanyol envers Catalunya.","301",NA
"Ni han fet ni han deixat fer.","301",NA
"El gran repte d’aquest mandat consisteix a transformar l’autonomia catalana en l’Estat català.","301",NA
"Hem d’anar a Madrid a fer política i a pactar la independència.","301",NA
"Perquè cal defensar el mandat democràtic de les urnes del 27S","H",NA
"Tenim un mandat clar: la constitució d’un Estat català independent.","301",NA
"I ho volem fer bé, seguint escrupolosament les regles democràtiques i el full de ruta compromès a les eleccions del 27 de setembre.","301",NA
"Anem a Madrid amb la voluntat d’un diàleg sincer amb l’Estat espanyol per tal de garantir la màxima seguretat jurídica de tot el procés i evitar perjudicis innecessaris a qualsevol de les parts implicades.","301",NA
"El nostre ànim no és anar en contra d’Espanya, ans al contrari.","301",NA
"Tot complint el mandat democràtic de les urnes, volem enraonar i cercar solucions que resultin beneficioses per a tothom.","301",NA
"També serà imprescindible establir el diàleg i la negociació amb les institucions de la Unió Europea i altres organismes internacionals.","301",NA
"Per culminar amb èxit la independència, es requereix el reconeixement internacional, cosa que va lligada amb el respecte degut a les regles del joc i a les de la cultura democràtica europea.","301",NA
"En aquest sentit, és imprescindible fer-ho bé, ser escrupolosos i actuar de manera impecable.","301",NA
"Ara més que mai és necessari tenir veu i interlocució a les Corts Espanyoles per poder dur a terme aquestes negociacions i ser presents allà on es prenen decisions que afecten a tots els catalans.","301",NA
"Per la regeneració democràtica. Una nova generació de persones a Madrid","H",NA
