"text","cmp_code","eu_code"
"La priorització del pagament a proveïdors exigida en el FLA ha endarrerit el pagament de subvencions a la dependència, ajuts a famílies, a les universitats i altres de caràcter social.","504",NA
"•",NA,NA
"Articularem un tram del FLA per possibilitar amortitzacions anticipades de préstecs a elevats tipus d’interès de les comunitats autònomes.","408",NA
"•",NA,NA
"Arbitrarem els mecanismes legals necessaris per facilitar que el deute subjacent en els projectes de finançament d’infraestructures amb pagament diferit (PPP), que ja hagi estat objecte de consolidació en el deute de les comunitats autònomes, pugui ser objecte de subrogació per part de les mateixes, amb la voluntat de fer-ne una amortització anticipada mitjançant el FLA i possibilitar així la reducció de la despesa en concepte de càrrega financera.","414",NA
"•",NA,NA
"Habilitarem una pròrroga en les devolucions de les quotes dels préstecs i bestretes concedides per l’Estat en l’àmbit de recerca als parcs científics.","411",NA
"La modificació del sistema de finançament de la Generalitat i de les corporacions locals","H",NA
"L’Estat ha estat deslleial amb el finançament de les administracions territorials.","301",NA
"L’1 de gener de 2014 havia d’entrar en vigor una revisió del sistema de finançament de les comunitats autònomes, és a dir, de la Generalitat.","301",NA
"L’Estat estava obligat a revisar-lo i no ho ha fet.","301",NA
"També estava obligat a revisar el finançament de les corporacions locals, tampoc ho ha fet.","301",NA
"Aquest fet ha representat més recursos per a l’Estat i menys per a la Generalitat i pels ajuntaments.","301",NA
"Per tant: • Exigirem la immediata revisió del sistema de finançament de la Generalitat i, d’acord amb la LOFCA, demanarem que es faci amb efectes retroactius des de la finalització de l’anterior quinquenni (2009-2013), és a dir, des de l’1 de gener de 2014.","301",NA
"En la revisió del model de finançament vigent és imprescindible invertir la injusta discriminació que pateix Catalunya: Avui Catalunya és el segon territori en capacitat tributaria (aportació de recursos fiscals a l’Estat) i la penúltima en recursos rebuts (en termes reals).","301",NA
"• Reclamarem, un cop més, el pagament de les bestretes corresponents al Fons de Competitivitat que ens pertoquen pel 2014, el 2015 i el 2016, el qual té com a objectiu reduir les diferències en finançament homogeni per càpita entre comunitats autònomes. •","301",NA
"Reclamarem de nou la revisió del finançament a les corporacions locals","301",NA
"L’augment de la participació de Catalunya en les inversions de l’Estat","H",NA
"L’Estat inverteix poc a Catalunya i la gestió de les inversions estatals s’eternitza.","408",NA
"Catalunya pateix un dèficit crònic d’inversions de l’Estat que s’ha aguditzat en aquesta legislatura.","408",NA
"El pes de les inversions pressupostades de l’Estat a Catalunya respecte al total de les inversions (10,6%) s’ha situat clarament per sota tant del pes de la població catalana respecte al del conjunt de l’Estat (16%) com del pes del PIB català respecte al PIB estatal (18,6%).","408",NA
"En el període 2011-2016, l’Estat ha reduït la inversió a Catalunya en un 57% mentre que la reducció global de les inversions per a tot l’Estat, sense tenir en compte Catalunya, ha estat molt més moderada, del 35%.","408",NA
"A més, a Catalunya, més del 20% de la inversió anual pressupostada per l’Estat no s’executa, cosa que equival que de cada cinc anys pressupostats un no s’executi res, i li surti de franc a l’Estat.","408",NA
"És per això que cal exigir a l’Estat que inverteixi en aquelles infraestructures de competència estatal que incideixen tant en el nostre teixit productiu com en el benestar dels ciutadans, des del corredor mediterrani fins als serveis de Rodalies.","411",NA
"Exigirem que l’Estat inverteixi a Catalunya en funció del pes del PIB català respecte del PIB estatal, tal i com estableix l’Estatut d’Autonomia de Catalunya, o bé que es pagui la compensació pertinent com a deute històric.","408",NA
"La recuperació de les transferències de l’Estat a la Generalitat destinades a programes socials (dependència, infància, polítiques actives d’ocupació, etc.)","301",NA
"Les polítiques d’austeritat de l’Estat durant la darrera legislatura s’han concretat en bona part en la retallada de transferències de caràcter social cap a la Generalitat, així com a les administracions locals.","504",NA
"En aquests anys, l’Estat ha centrifugat dèficit cap a les altres administracions, dèficit que afectava les despeses socials.","504",NA
"Cal abordar un pla per a la recuperació de les transferències socials de l’Estat, el qual ha d’incloure:","504",NA
"•",NA,NA
"La cobertura del 50% corresponent al finançament del desplegament de la Llei de dependència, incloent-hi la cobertura financera per part de l’Estat del nivell conveniat.","504",NA
"L’any 2015 la Generalitat va destinar 1.004 M.€ a finançar l’atenció a la dependència, mentre que l’Estat només va destinar 223M.€ a Catalunya.","504",NA
"Si l’Estat contribuís amb els mateixos recursos que la Generalitat, 77.000 catalans que actualment no se’n poden beneficiar se’n beneficiarien.","504",NA
"• El Pla de Rodalies de Catalunya (2008-2015) suposava una inversió de més de 4.000 M€.","411",NA
"L’han incomplert tant els governs del PSOE com del PP, havent-se executat fins ara un ridícul 10%","411",NA
"Cal exigir a l’Estat el compromís amb un calendari d’inversions en Rodalies imprescindibles i a curt termini.","411",NA
"• La recuperació dels fons destinats a polítiques actives d’ocupació que gestionava la Generalitat, recursos que van ser reduïts dràsticament de manera unilateral per l’Estat en els pressupostos 2012 i 2013","504",NA
"• La recuperació i millora del Fons Estatal d’Acollida i Integració de persones immigrants, anul·lat també unilateralment per l’Estat.","607.2",NA
"• La recuperació dels recursos destinats a educació infantil,","506",NA
"dels fons destinats a compensar la Generalitat per les despeses d’assistència sanitària corresponents a persones desplaçades d’altres comunitats,","504",NA
"dels fons a infraestructures culturals de Catalunya","502",NA
"i a infraestructures de recerca","411",NA
"i un llarg llistat de recursos que l’Estat ha retallat de les transferències que feia a les comunitats autònomes.","301",NA
"L’aixecament de les limitacions de l’Estat a les mesures tributàries de la Generalitat destinades a incrementar els ingressos","301",NA
"L’Estat ha incrementat els seus impostos alhora que ha recorregut sistemàticament tot intent de la Generalitat de millorar els seus ingressos amb impostos que principalment requeien sobre les entitats bancàries, els operadors de telecomunicacions o les companyies elèctriques generadores d’energia nuclear.","301",NA
"Per aquesta via la Generalitat podria haver percebut més de 840 M.€ anuals addicionals d’ingressos.","414",NA
"• Exigirem l’aixecament de les limitacions de l’Estat a la Generalitat corresponents a impostos aprovats pel Parlament de Catalunya i vetats per l’Estat.","301",NA
"Concretament l’Estat ha paralitzat, mitjançant el recurs al Tribunal Constitucional: • L’impost pels dipòsits bancaris de la Generalitat o la seva compensació, tal com s’ha fet amb altres comunitats autònomes com ara Canàries, Andalusia i Extremadura.","301",NA
"Suposaria uns ingressos anuals addicionals per la Generalitat de més de 600M.€ en relació a la que percep actualment de la taxa estatal","414",NA
"• La compensació per la taxa sobre l’expedició de recepta mèdica recorreguda per l’Estat al Tribunal Constitucional","414",NA
"• El cobrament del impost a l’energia nuclear, també recorreguda pel Govern estatal al Tribunal Constitucional","414",NA
"El cobrament del impost a les operadores de telecomunicacions","414",NA
"• El cobrament del impost sobre els pisos buits propietat de grans operadors immobiliaris, com ara els bancs o la Sareb, igualment recorregut al Tribunal Constitucional","414",NA
"La participació de la Generalitat en els augments de recaptació derivats de l’alça de l’IVA i altres impostos estatals als catalans","H",NA
"El Govern del Partit Popular a l’inici de la Xa legislatura va adoptar nombroses decisions de reforma fiscal amb l’objectiu d’incrementar la pressió fiscal: L’IRPF, l’impost sobre societats, l’IVA, els impostos especials, entre d’altres, van ser modificats per incrementar-ne la recaptació.","414",NA
"Com a conseqüència de les esmentades decisions, els ingressos pressupostats per l’Estat pel 2016 en concepte d’impostos directes i indirectes són 20.581 M.€ superiors als pressupostats per l’any 2011 (darrer exercici del govern Zapatero), és a dir un 22% superiors que al 2011, quan el PIB nominal s’ha mantingut pràcticament invariable.","414",NA
"Això significa que, en anys de crisis, el Govern PP ha fet créixer fortament la pressió fiscal de l’Estat.","414",NA
"Gràcies a aquest augment de la pressió fiscal, en els darrers 4 anys (2013-2016), l’Estat ha aconseguit un increment acumulat dels seus ingressos per impostos directes i indirectes de 71.260 M€, els quals a ningú se li escapa que a l’entorn del 18-20 per cent procedien de Catalunya.","414",NA
"No obstant això, cal constatar que la totalitat de l’augment de recaptació ha anat a parar a les arques de l’Estat per equilibrar els seus comptes.","414",NA
"La Generalitat no ha participat en els increments d’ingressos que han pagat els catalans, amb la qual cosa, ni la sanitat, ni l’educació, ni els serveis socials han pogut beneficiar-se del major esforç fiscal que ha fet el contribuent en aquests anys de crisi econòmica.","504",NA
"Només si la meitat d’aquest increment d’ingressos s’hagués distribuït a les comunitats autònomes, amb els criteris vigents en el model de finançament, Catalunya hauria obtingut 6.200 M€ més, si l’estimació es compara amb la previsió de 2011.","301",NA
"Per tant, reclamarem que la Generalitat participi efectivament de l’augment net de la recaptació dels impostos que l’Estat ha incrementat en la legislatura passada i que aquest increment tingui efectes retroactius.","301",NA
"Com a mínim, respecte dels impostos pagats pels catalans, la Generalitat ha de participar del 50% de l’increment de recaptació derivat de l’alça de l’IVA, del 58% de l’increment de recaptació derivat de l’alça dels impostos especials, inclosos els nous impostos sobre la llum, i del 100% dels nous impostos sobre joc, loteries i gasos fluorats.","301",NA
"La consideració del cost de la vida com a factor d’equiparació en les prestacions socials i en els impostos progressius","H",NA
"El cost de la vida és important: no és el mateix un salari mileurista en un país de la Unió Europea que en un altre amb realitats socioeconòmiques molt diferents, ja que la capacitat de compra de 1.000 € i el cost de vida en un país o en l’altre és radicalment diferent.","408",NA
"El mateix passa entre els territoris de l’Estat espanyol: tenim profundes diferències de preus.","408",NA
"Amb dades de 2012, en el cas de Catalunya, la paritat amb la comunitat autònoma que manté els preus més baixos seria de 1,35.","408",NA
"És a dir, a Catalunya es necessitarien 1.350 € per pagar una mateixa cistella de la compra que a la comunitat amb els preus més baixos costés 1.000 €.","408",NA
"Ignorar aquestes diferències en el cost de la vida vol dir que, sota una pàtina d’igualtat monetària entre territoris, s’estan ignorant grans discriminacions entre els ciutadans en molts aspectes.","503",NA
"Per exemple: • prestacions no contributives que són iguals monetàriament, però molt diferents en poder adquisitiu; •","504",NA
"diferències substancials en la qualitat de determinats serveis públics que es presten, com ara una plaça en una residència de la tercera edat, un llit hospitalari, una plaça de guarderia; serveis que tenen costos diferents en territoris diferents;","504",NA
"• discriminacions molt rellevants quan es tracta de determinar el llindar per a l’accés a beques o, en el cas de la lluita contra les desigualtats, per establir el llindar de la pobresa.","504",NA
"Per tot plegat, cal incorporar el cost de la vida en la determinació del càlcul de les prestacions socials i econòmiques, ja que és un factor d’igualtat que l’Estat espanyol mai no ha tingut en compte.","503",NA
"Així mateix, cal corregir l’impost sobre la renda, que és progressiu, amb el cost de la vida, com per exemple en la determinació dels mínims personals, els quals a Catalunya han de ser més elevats que en territoris amb el cost de la vida menor.","408",NA
"3.2.2 Ocupació: creixement i més polítiques per a la creació de llocs de treball","H",NA
"Catalunya no disposa d’un Estat ni de les eines necessàries per facilitar més oportunitats de feina, derivades de la capacitat de legislar en matèria laboral;","301",NA
"no té capacitat per disposar de més recursos,","408",NA
"decidir els increments de la despesa pública,","409",NA
"de la millora de la seva eficàcia","303",NA
"i de la seva orientació cap al creixement.","410",NA
"Mentre no disposi d’aquestes eines, cal continuar portant a terme actuacions, en el marc de les Corts espanyoles, per mirar d’accelerar la sortida de la crisi, crear ocupació i reduir l’atur.","410",NA
"En el marc de l’objectiu que tenim com a país, Catalunya ha de ser un territori equiparable en matèria d’ocupació als països més avançats socialment de la UE, tant en el sistema d’ocupació","410",NA
"com en els subsistemes de relacions laborals, de relacions sindicals i de prestacions socials.","405",NA
"L’objectiu i el repte són clars: establir un nou sistema laboral que faci de Catalunya un país capdavanter.","410",NA
"Aquest fet implica un nou paradigma de coresponsabilitat i, alhora, de rigor en la definició i l’aplicació de polítiques publiques de l’àmbit laboral, en el qual tots els protagonistes són implicats.","405",NA
"Mentre transitem, però, fins aquest objectiu, tenint en compte que la competència legislativa en matèria de mercat de treball i relacions laborals correspon encara a l’Estat, i que la prioritat és lluitar contra l’atur i crear ocupació de qualitat, reclamarem mesures que són imprescindibles per garantir una recuperació sòlida i justa.","701",NA
"Cal recuperar el diàleg social i el consens amb els interlocutors socials.","405",NA
"Treballarem perquè el sistema de relacions laborals s’actualitzi, responent a la lògica de la flexibilitat que les empreses demanden per competir i a la de la seguretat que els treballadors necessiten.","405",NA
"Cal que es modifiqui el sistema d’indemnitzacions per acomiadament i es simplifiquin les modalitats contractuals, entre d’altres, per tal de garantir els drets de les persones treballadores,","701",NA
"per impulsar el creixement i la competitivitat de les nostres empreses","410",NA
"i per facilitar la creació i el manteniment d’ocupació de qualitat.","701",NA
"En matèria de treball, la formació per a l’ocupació és un factor essencial alhora de garantir un bon lloc de treball.","411",NA
"Cal establir noves operatives en la formació dels joves, més flexibilitat en les titulacions i més formació dual en les nostres empreses i escoles.","411",NA
"Cal, també, més formació per a les persones treballadores, de manera que s’implanti un model de creixement professional al llarg de la vida laboral i que es reconeguin les competències laborals adquirides a través de la feina.","411",NA
"Cal, també, formació per incrementar l’ocupabilitat de les persones en situació d’atur i la requalificació dels treballadors, especialment la dels majors de 45 anys en les noves competències que demani el mercat de treball.","411",NA
"En aquest sentit, s’han de garantir les transferències dels recursos necessaris des de l’Estat a la Generalitat de Catalunya, i que es respectin les seves competències d’acord amb l’Estatut, mentre no les assumeixi en la seva totalitat.","301",NA
"Afrontem el repte d’un teixit productiu que ha de ser capaç d’oferir millors llocs de treballs per a joves, amb titulacions superiors, que avui estan obligats a emigrar o a treballar en feines que no tenen res a veure amb el seu nivell formatiu.","701",NA
"És una enorme pèrdua de talent que no és pot menystenir.","408",NA
"Per tots aquests motius, el paper del sistema públic d’ocupació és clau.","504",NA
"Cal garantir que el Sistema Públic d’Ocupació de Catalunya lideri i gestioni les polítiques actives i passives d’ocupació, amb els subsistemes de formació,","504",NA
"i que disposi d’un increment substancial de la inversió pública per pilotar amb garanties els canvis, equiparant el pes de la inversió entre les polítiques actives i passives, com succeeix a la majoria de països altament competitius d’Europa.","504",NA
"L’objectiu essencial és l’impuls de l’actuació dels serveis públics d’ocupació en relació amb les necessitats del mercat de treball.","504",NA
"Un impuls que hauria de passar per bastir un model més àgil i més eficient, centrat en l’atenció personalitzada,","303",NA
"que doni cobertura de servei a tot el territori,","504",NA
"que contribueixi de manera efectiva a la millora de l’ocupabilitat de la població activa,","504",NA
"que millori les taxes d’intermediació,","504",NA
"que orienti la seva actuació a les necessitats del mercat de treball","504",NA
"i que col·labori amb les iniciatives privades, tant socials com mercantils.","505",NA
"La crisi econòmica s’ha significat especialment amb la destrucció de milers de llocs de treball.","701",NA
"Però també ha implicat, per a amplis sectors de les persones treballadores, una pèrdua d’estabilitat i de poder adquisitiu per la baixada de salaris, que s’ha acabat materialitzant en un increment de la desprotecció i la pobresa i en un descens dels nivells de cobertura de la protecció social.","504",NA
"Els costos de la crisi no s’han repartit de forma equilibrada i haurem de dedicar molts esforços a compensar aquest fet.","503",NA
"Els primers que han de notar els efectes de la recuperació són els que més han patit els efectes de la crisi.","408",NA
"D’altra banda, cal destacar que s’ha començat a crear ocupació.","701",NA
"Aquesta és, en contra del que es pretenia amb les reformes laborals, fonamentalment temporal i en gran part a temps parcial, alhora que amb salaris baixos.","701",NA
"S’ha incrementat la flexibilitat, la capacitat de les empreses per adaptar-se a la situació econòmica i a les necessitats i demandes del mercat, però no s’ha protegit com cal els treballadors davant del deteriorament de les condicions de treball i davant de les situacions d’atur.","701",NA
"En el fons, s’ha dibuixat un model de precarietat laboral que pivota sobre la idea, induïda o assumida pel Govern espanyol, que la competitivitat està associada fonamentalment a la reducció de drets laborals per a les persones treballadores.","701",NA
"En canvi, no s’han aplicat polítiques que facilitin el creixement de les empreses, sobretot de les pimes,","402",NA
"ni mesures que garanteixin als treballadors una protecció adequada i un trànsit ràpid des de l’atur al treball.","701",NA
"Necessitem un nou enfocament que vinculi clarament el creixement i la recuperació econòmica amb una distribució més justa de la riquesa.","503",NA
"Cal corregir el que ha succeït durant els anys de la recessió ara que el cicle econòmic sembla que canvia de tendència.","410",NA
"I cal una política laboral adequada a aquest nou enfocament.","410",NA
"Les mesures que caldrà emprendre a les Corts Generals, mentre Catalunya no compti amb les eines i els recursos propis en matèria laboral, són:","408",NA
"Creació i manteniment de llocs de treball de qualitat","H",NA
"• Reduirem la dualitat del mercat de treball i contribuirem a la creació d’ocupació estable,","701",NA
"impulsant un procés de negociació amb les organitzacions empresarials i sindicals més representatives en els seus respectius àmbits d’actuació, que possibiliti l’elaboració i l’aprovació d’un projecte de llei que reguli:","405",NA
"• la constitució d’un fons de capitalització per als treballadors que es nodriria d’aportacions empresarials mensuals en funció del salari, l’abonament del qual podria fer-se efectiu a favor del treballador en els supòsits d’acomiadament, de canvi d’empresa o en el moment de la seva jubilació (model austríac);","701",NA
"• i un nou sistema d’indemnitzacions per acomiadament que faci més costoses les extincions a curt termini, amb independència de la modalitat contractual temporal o indefinida, desincentivi les extincions improcedents i no suposi un increment de costos a l’empresa ni una reducció de la protecció al treballador, distribuint incentius i sancions d’una forma més adequada.","403",NA
"• Reclamarem la implantació d’un sistema de penalització a les empreses que acomiaden en excés.","403",NA
"Un sistema que incrementi progressivament les cotitzacions empresarials a la seguretat social en concepte de desocupació per a les empreses que, comparativament, acomiadin un nombre major de treballadors de forma no justificada.","403",NA
"Un sistema que beneficiï les empreses que efectuïn menys extincions de contractes, tot disminuint les cotitzacions esmentades.","403",NA
"• Iniciarem un procés de negociació amb les organitzacions empresarials i sindicals més representatives que possibiliti l’elaboració i l’ aprovació d’un projecte de llei per avançar en la reducció, la simplificació i l’adequació de les nombroses modalitats contractuals que coexisteixen en la legislació laboral espanyola. •","405",NA
"Vigilarem i sancionarem més la contractació fraudulenta i l’economia submergida per lluitar contra la precarietat, especialment entre els joves i la gent que perd la feina.","403",NA
"Dotarem amb més recursos la Inspecció de Treball de Catalunya.","403",NA
"• Establirem, d’acord amb les organitzacions sindicals i associacions empresarials més representatives en els seus respectius àmbits d’actuació, un calendari d’increment progressiu del salari mínim interprofessional (SMI) que permeti avançar progressivament fins a aconseguir l’objectiu establert a la Carta Social Europea: que el SMI es situï en el 60% del salari mig. •","412",NA
"Impulsarem un acord entre els agents econòmics i socials per adoptar una estratègia que tingui per objectiu evitar l’existència de “treballadors pobres” i la reducció de la “bretxa salarial” de gènere.","503",NA
"• Promourem la modificació de la Llei 3/2012, de 6 de juliol, de mesures urgents per a la reforma del mercat laboral, que es proposi fruit del diàleg i de l’acord entre els interlocutors socials, per tal de millorar i resoldre les qüestions que en la seva aplicació s’estan manifestant millorables o inadequades, com ara per exemple:","405",NA
"• La primacia del conveni d’empresa front a la prevalença del conveni autonòmic. (Amb un teixit de pimes i microempreses del sector serveis, que empeny a competir en sous baixos i poc creixement de la productivitat).","403",NA
"• L’articulació entre els diferents nivells de la negociació col·lectiva i l’ampliació de la seva cobertura, de manera que es possibiliti l’adaptació de les condicions laborals a la situació de cada empresa, però garantint un marc que doni seguretat i eviti la competència a la baixa en les condicions de treball","405",NA
"• La regulació establerta per a la contractació a temps parcial.","403",NA
"• El paper de l’autoritat laboral en els expedients de regulació d’ocupació (ERO) per promoure l’acord entre les parts en condicions adequades.","403",NA
"En aquesta línia, impulsarem també el diàleg social amb l’objectiu d’anar més enllà, i assolir un acord que permeti l’elaboració i aprovació d’un nou marc de relacions laborals que garanteixi els drets dels treballadors, faciliti la competitivitat de les empreses i s’adeqüi a les noves realitats socials, especialment, en l’àmbit de la conciliació de la vida familiar i personal, i de l’expansió de les tecnologies de la informació i la comunicació.","405",NA
"• Presentarem i tramitarem un projecte de llei de regularització d’ocupació i impuls a la creació de nous llocs de treball en el sector de la prestació de serveis a les famílies i a les persones.","403",NA
"• Impulsarem una reducció de les quotes empresarials en sectors intensius en mà d’obra i dels costos laborals de les ocupacions menys qualificades i remunerades. •","402",NA
"Potenciarem els sectors ambientals que poden generar nova ocupació amb incentius fiscals, administratius i socials, per afavorir la creació d’ocupació en l’àmbit de l’economia verda.","416.2",NA
"• Apostarem per la rehabilitació del parc d’habitatges i la renovació urbana, i en particular promourem programes de rehabilitació vinculada al estalvi energètic.","416.2",NA
