"text","cmp_code","eu_code"
"Correspondrà a la Generalitat impulsar i determinar la senyalització turística a les carreteres de titularitat estatal.","301",NA
"•",NA,NA
"Atès el pes del turisme internacional a Catalunya, la Generalitat podrà designar, dins de la delegació espanyola, un representant davant l’Organització Mundial de Turisme.","301",NA
"Agricultura","H",NA
"•",NA,NA
"Orientarem l’acció política vers la defensa de la nostra agricultura i pesca marítima en aspectes que li estan vinculats, com poden ser: l’aigua, l’energia, el trànsit comercial, la gestió de la plataforma litoral i la seguretat del sector pesquer, sense oblidar la protecció dels nostres boscos.","703.1",NA
"• Exigirem la rectificació del Real Decret que ha aprovat el Pla Hidrològic del Ebre a la seva desembocadura per garantir el cabal suficient per a la conservació física del Delta de l’Ebre, tant qualitativament com quantitativament.","501",NA
"Per això, caldrà negociar la gestió de l’aigua a la conca de l’Ebre per garantir la compatibilitat entre els cabals necessaris per la conservació del Delta amb l’abastament de les explotacions agràries catalanes i les vinculades al Canal Aragó-Catalunya. •","703.1",NA
"Durem a terme la regulació de cabals procedents de la Noguera Ribagorçana, la Noguera Pallaresa i el Segre per permetre la producció agrària de qualitat als sistemes de reg catalans i de la franja.","703.1",NA
"Eliminarem el cànon de control d’abocaments a l’Ebre que cobra actualment la Confederació Hidrogràfica de l’Ebre.","703.1",NA
"• Exigirem l’adaptació de la normativa estatal relativa a la PAC, per exemple, en allò que fa referència a la definició d’agricultor actiu com aquelles persones físiques o jurídiques que tinguin l’agricultura o la ramaderia com a activitat principal i a reforçar el suport als agricultors joves.","703.1",NA
"• Així mateix, en el context de l’adequació de la normativa a la PAC, cal incorporar produccions com les de l’alfals o de la olivera de baix rendiment entre els conreus beneficiaris dels ajuts acoblats i adequar els ajuts associats al model de regionalització previst en el RD 1075/2014. •","703.1",NA
"Transferirem a Catalunya la inspecció sanitària en origen, o en ports i aeroports, ja que ha de ser l’Administració catalana l’encarregada de garantir la seguretat alimentària, la protecció mediambiental i la protecció de la producció agrària en el seu territori, així com l’encarregada de cobrar els aranzels d’entrada a Catalunya.","301",NA
"•",NA,NA
"Donarem suport a les confraries de pescadors i als seus acords de pesca marítima vigents per garantir la sostenibilitat econòmica i mediambiental del sector.","416.2",NA
"Cal negociar el dret a percebre indemnitzacions per aturades biològiques als vaixells catalans de les arts afectades dins la plataforma de pesca.","416.2",NA
"•",NA,NA
"Establirem protocols de coordinació, similars als que hi ha amb França, per mantenir la col·laboració en incendis forestals transfronterers.","501",NA
"Mantindrem la capacitat d’acció dels bombers i les agrupacions de defensa forestal catalans en territori espanyol limítrof, així com dels efectius espanyols tant civils com militars en territori català.","501",NA
"3.2.8. Garantir la competitivitat empresarial","H",NA
"Les polítiques públiques han d’afavorir la competitivitat del país perquè pugui desenvolupar-se satisfactòriament dins d’una economia cada vegada més globalitzada.","408",NA
"Aquesta competitivitat és transversal i afecta tant a les condicions en què han d’operar les empreses (regulacions, infraestructures, fiscalitat...) com a les potencialitats de les mateixes empreses.","408",NA
"En aquest últim aspecte, el rol de les administracions és d’acompanyament i de suport, però el protagonisme indubtable i insubstituïble és el de l’empresariat.","401",NA
"S’ha de respectar, doncs, aquesta visió a l’hora de formular les polítiques públiques.","401",NA
"Això no és incompatible amb l’exercici de la responsabilitat, també pública, de protegir els consumidors,","403",NA
"vetllar pel benestar i la dignitat de les persones","201.2",NA
"o preservar la qualitat ambiental aplicant els principis de sostenibilitat.","416.2",NA
"En aquest sentit, les grans qüestions d’aquesta legislatura han d’anar en la direcció de: • Derogar en la seva integritat la llei de garantia de la unitat de mercat.","301",NA
"Aquesta llei, és una veritable reforma encoberta de la Constitució, que buida de contingut econòmic les competències de la Generalitat,","301",NA
"afavoreix els grans grups empresarials,","403",NA
"retalla la protecció del consumidor","403",NA
"i desincentiva la innovació.","411",NA
"En aquest sentit, les raonables aspiracions a un mercat únic -que no és sinònim d’unitat de mercat- ja queden fixades per les directives comunitàries i cal evitar anar més enllà en la uniformització. •","301",NA
"Crear un marc que deixi de posar traves i, ben contràriament, estimuli les polítiques pròpies de la Generalitat en matèria d’internacionalització, d’innovació i d’emprenedoria.","301",NA
"I, paral·lelament, reconèixer la diversitat de la realitat empresarial i, en conseqüència, fer polítiques que atenguin adequadament les petites i mitjanes empreses, els sectors consolidats i els sectors emergents.","403",NA
"Caldrà combatre la tendència del govern espanyol de privilegiar les empreses molt grans, especialment les derivades d’antics règims de monopoli.","403",NA
"En aquest sentit, altres mesures que s’han d’impulsar en diferents camps en favor de la competitivitat són:","408",NA
"En la internacionalització: • Establiment d’un sistema més eficaç i flexible de crèdits a les exportacions. •","406",NA
"Adequació de la fiscalitat per a l’estímul de les exportacions, especialment en el cas de pimes, i major celeritat en el retorn de l’IVA.","402",NA
"•",NA,NA
"Obertura durant 24 h al dia i 365 dies a l’any dels serveis ministerials necessaris per a la importació i l’exportació de béns a través dels ports i els aeroports catalans.","408",NA
"•",NA,NA
"Facilitar els visats d’entrada per a inversors, clients, directius i professionals que tinguin relació amb empreses catalanes.","408",NA
"•",NA,NA
"Millora de les condicions i els processos d’expatriació i impatriació, especialment quan afecten les pimes.","408",NA
"•",NA,NA
"Adequació dels programes de suport de la internacionalització de la Cámara de España a les estratègies i prioritats fixades per la Generalitat de Catalunya en allò que afecti les empreses catalanes.","402",NA
"• Transferència del 20% del pressupost de l’ICEX a ACCIÓ i tancament de l’oficina de l’ICEX a Catalunya per tal que el suport públic a la internacionalització de les empreses catalanes es vehiculi a través d’ACCIÓ en la seva integritat.","301",NA
"• Descentralització de la gestió de les grans infraestructures aeroportuàries, portuàries i de transport per ferrocarril, acompanyades de les corresponents inversions pera potenciar la competitivitat del teixit productiu català. Exemples: xarxa portu'ria i aeroportuària catalanes, corredor del mediterrani.","301",NA
"En la innovació empresarial: • Adopció de la patent única europea i millora general de la protecció de la propietat intel·lectual. •","403",NA
"Millora de les condicions fiscals de la innovació.","411",NA
"•",NA,NA
"Disminució de l’impacte negatiu de l’iva sobre els projectes dels centres de R+D+i.","411",NA
"•",NA,NA
"Aprovació d’un pla de foment de la compra pública innovadora.","411",NA
"•",NA,NA
"Establiment d’un fons dels pressupostos generals de l’estat, a gestionar per la Generalitat en el cas de Catalunya, per a la digitalització dels processos productius (Indústria 4.0).","411",NA
"•",NA,NA
"Establiment d’un programa d’ajuts, a transferir perquè gestioni la Generalitat en el cas de Catalunya, per a la renovació de maquinària i altre instrumental obsolet de les empreses per equips que incorporin tecnologies més avançades.","411",NA
"• Transferència del 20% del pressupost del CDTI a ACCIÓ per tal que el suport públic a la innovació empresarial a Catalunya es vehiculi a través d’ACCIÓ.","301",NA
"En l’emprenedoria: • Reforma de la legislació sobre emprenedoria per a equiparar els incentius als existents a les economies occidentals més avançades. •","402",NA
"Definició d’un marc legal, laboral i fiscal que afavoreixi l’impuls de les empreses emergents, de les empreses derivades de projectes de centres de recerca i dels centres tecnològics i de transferència de coneixement a les empreses.","402",NA
"•",NA,NA
"Revisió del marc legal i fiscal i de les polítiques instrumentals per a facilitar la segona oportunitat.","402",NA
"•",NA,NA
"Creació d’un marc administratiu i fiscal favorable per a la captació i la instal·lació de talent forà","402",NA
"3.2.9 Defensa de la petita i mitjana empresa i dels emprenedors autònoms","H",NA
"La política econòmica ha de tornar a mirar cap a les pimes i els autònoms.","403",NA
"A Espanya massa sovint s’identifica el monopoli amb els horaris comercials i amb les regulacions professionals.","403",NA
"Els autèntics costos monopolístics els representa l’abús de poder per part de la gran empresa, sigui regulada o no.","403",NA
"Mai a Espanya s’ha defensat amb prou energia la competència front aquesta amenaça.","403",NA
"Cal denunciar la regulació - o la manca de regulació - que permet que la gran empresa abusi del seu poder.","403",NA
"A la vegada falta finançament i simplificació administrativa i sobra morositat.","403",NA
"La fiscalitat que avui grava les pimes és molt superior a la que grava les grans empreses.","403",NA
"En aquest sentit: • Cal abaratir i millorar l’accés al crèdit a pimes i autònoms, ja que constitueixen més del 90% del teixit productiu.","402",NA
"El crèdit a les pimes continua en nivells baixos i els tipus d’interès que paguen són massa alts.","402",NA
"Aquest és un compromís que ha de superar les promeses que periòdicament fa el ministeri per passar a fer-se realitat.","402",NA
"Urgeix aprofitar els recursos crediticis procedents de les institucions europees destinades a les PIMES i el finançament alternatiu al sistema bancari, entre uns altres, el crowdfunding, els business angels, el Mercat Alternatiu de Renda Fixa (MARF), el Mercat Alternatiu Borsari (MAB) així com mesures normatives i fiscals perquè les PIMES puguin finançar-se a través d’ells. •","402",NA
"Orientarem el crèdit oficial a la inversió en creixement empresarial a llarg termini.","402",NA
"•",NA,NA
"Revisarem especialment la fiscalitat sobre pimes i millorarem el tractament fiscal dels beneficis reinvertits a l’empresa.","402",NA
"•",NA,NA
"Modificarem la llei sobre les segones oportunitats, per simplificar i agilitar la seva aplicació.","402",NA
"•",NA,NA
"Modificarem tots els aspectes legislatius que posen dificultats pràctiques al creixement de les petites empreses més enllà dels cinquanta treballadors o els deu milions de facturació per obligacions addicionals.","402",NA
"•",NA,NA
"Designarem el responsable de la Generalitat en matèria de pimes com a SME Envoy adjunt del SME Envoy espanyol i podrà acompanyar-lo a totes les reunions sobre aquesta matèria que convoqui i organitzi la Comissió Europea.","402",NA
"• Adoptarem més i més intenses mesures laborals específiques de suport a la creació d’ocupació en les microempreses per aprofitar el seu major potencial en creació de llocs de treball a curt termini. •","402",NA
"Compra pública per a pimes: un dels rols que desenvolupa l’Administració pública és el de comprador.","402",NA
"Per afavorir el creixement i desenvolupament de les pimes, proposarem establir un objectiu determinat i creixent de participació de les pimes i els autònoms en la contractació pública, tal com ja succeeix en d’altres països.","402",NA
"•",NA,NA
"Incrementarem els pressupostos destinats a activitats d’emprenedoria de base tecnològica mitjançant programes de creació com Neotecs, i creixement com crèdits per a l’adquisició d’start-ups per part d’empreses consolidades.","402",NA
"3.2.10 Acord Transatlàntic per al Comerç i la Inversió entre Europa i EUA (TTIP)","H",NA
"Convergència valorarà amb prudència l’Acord Transatlàntic per al Comerç i la Inversió entre Europa i EUA (TTIP).","407",NA
"L’Acord pot plantejar interessants oportunitats de creixement econòmic i de creació d’ocupació, però cal garantir que el desplegament d’aquestes oportunitats es materialitzi en benefici de tots els ciutadans i de l’activitat econòmica de Catalunya.","407",NA
"Per això, Convergència exigirà transparència, informació sobre el seu contingut i sobre els seus efectes previsibles, així com major participació dels Estats i dels seus parlaments, com a condicions indispensables en l’elaboració del text definitiu i com a qüestions prèvies a la valoració sobre si se li ha de donar suport.","407",NA
"És transcendental que l’eliminació d’obstacles reglamentaris al comerç es faci preservant, en tot moment, els drets socials i dels consumidors i disposant del més ampli coneixement possible de l’impacte sectorial i sobre les pimes que pot tenir l’Acord.","407",NA
"Les millors interrelacions comercials entre Europa i EUA han de resultar en un mercat més extensiu i competitiu,","407",NA
"però també en un mercat on hi hagi més garanties per als consumidors i on tots els actors implicats surtin reforçats.","403",NA
"Les petites i mitjanes empreses no poden resultar malparades d’aquest acord.","402",NA
"Un acord tan important ha de ser avaluat amb totes les garanties i cal que cada un dels sectors conegui les seves repercussions.","407",NA
"Donem prioritat a garantir el model social europeu,","403",NA
"la salvaguarda dels serveis públics essencials","504",NA
"i la cultura; és per això que no volem presses, sinó informació i garanties.","502",NA
"Cal exigir al Govern de l’Estat: • Més transparència en la negociació del text . •","407",NA
"Més informació sobre els impactes sectorialitzats de l’Acord.","407",NA
"•",NA,NA
"La realització de debats sectorialitzats i amb els representants dels consumidors sobre els continguts i l’abast del text.","403",NA
"•",NA,NA
"L’adopció de plenes garanties pels consumidors.","403",NA
"•",NA,NA
"La regulació adaptada a les necessitats de les pimes.","403",NA
"•",NA,NA
"La salvaguarda dels serveis públics essencials, dels drets socials","504",NA
"i de la singularitat de determinats sectors, com el de la cultura.","502",NA
"3.2.11 Unitat de mercat","H",NA
"Ningú no discuteix el que representa el mercat únic a la Unió Europea.","403",NA
"Són les normes de defensa de la competència i les diferents directives les que el configuren per a tota la Unió.","403",NA
"En aquest context, la Llei d’unitat de mercat aprovada pel Govern del PP respon a altres objectius.","305.1",NA
"És una llei més orientada a laminar les competències autonòmiques i a burocratitzar l’activitat de les administracions territorials que a incorporar elements positius en el funcionament del mercat i de l’activitat econòmica.","301",NA
"La pèrdua de drets per part dels consumidors serà probablement el primer i principal efecte d’aquesta llei.","403",NA
"La Llei d’unitat de mercat incentiva la proliferació d’activitats econòmiques basant-se en la premissa que la regulació més laxa és la que preval.","403",NA
"Aquest fet obre la porta que les comunitats autònomes competeixin entre elles per captar operadors sobre la base d’una rebaixa dels mínims estàndards de qualitat exigibles, amb la garantia que podran operar a tot l’Estat amb aquests estàndards.","403",NA
"Evidentment, serà el consumidor el més perjudicat, ja que el desprotegeix.","403",NA
"També el teixit econòmic i industrial en sortirà perjudicat.","403",NA
"Des de fa uns anys la Unió Europea exigeix les millors pràctiques en eficiència energètica o en ecodisseny.","403",NA
"Quan s’adopta una directiva o un reglament determinat exigint unes millors pràctiques sobre un producte, el temps d’adaptació és breu, de manera que són les empreses que s’han avançat a incorporar les millors pràctiques les que obtenen més avantatges.","403",NA
"Una economia que en comptes d’estimular les millors pràctiques estimula les pràctiques més laxes no impulsa la innovació: la castiga.","403",NA
"Això és el que provoca la Llei d’unitat de mercat.","403",NA
"Addicionalment, la complexitat del desplegament del sistema de connexió entre administracions de diferents comunitats autònomes per sancionar algun incompliment normatiu en el context de la Llei d’unitat de mercat és propi d’un sistema dissenyat per paralitzar les actuacions de l’Administració.","403",NA
"En conseqüència, exigirem la derogació de la Llei d’unitat de mercat.","403",NA
"3.2.12. Les infraestructures de futur: transport i comunicacions","H",NA
"La Generalitat de Catalunya ha de ser el gestor de les principals infraestructures de titularitat estatals de transport i comunicacions a Catalunya.","301",NA
"Un dels elements de la propera legislatura consistirà a negociar el canvi de titularitat de totes elles.","301",NA
"És el cas dels aeroports, ports, ferrocarrils i les infraestructures hidràuliques i d’abastament d’aigua.","301",NA
"En el període de negociació, durem a terme les actuacions que exposem tot seguit.","301",NA
"Ferrocarrils","H",NA
"En l’àmbit ferroviari, Ferrocarrils de la Generalitat de Catalunya ha estat reconeguda internacionalment com a exemple de bona gestió, moderna i orientada a l’usuari.","411",NA
"Aquest model de proximitat ha de guiar també la gestió de la resta de serveis ferroviaris: •","411",NA
"Reclamarem la titularitat i l’administració de la totalitat de la xarxa ferroviària que transcorre per Catalunya, conjuntament amb els fons suficients per poder realitzar les inversions necessàries, amb especial atenció a la xarxa regional i de rodalies i al Corredor Mediterrani.","301",NA
"• Demanarem, com a qüestió prioritària, el compliment del Pla de Rodalies 2008-2015 i de totes les inversions vinculades, tant pel que fa a temes de seguretat, a ampliació de capacitat o de millores d’estacions i intercanviadors.","411",NA
"Rodalíes és molt més que un ferrocarril, és mobilitat, és capacitat d’accés a la feina, és qualitat de vida.","411",NA
"• Reivindicarem el ple compliment del pla acordat d’eliminació de passos a nivell a Catalunya.","411",NA
"Entre aquests, exigirem una especial prioritat al inici de les obres pel soterrament de les vies a Montcada, eliminant així un pas a nivell molt transitat, amb un nefast balanç d’accidents mortals. •","411",NA
"Garantirem, un cop assumim les competències en matèria ferroviària, una explotació correcta dels serveis ferroviaris sense cap impacte sobre els usuaris i usuàries dels serveis de Rodalies de Catalunya, Mitjana Distància i Alta Velocitat.","411",NA
"•",NA,NA
"Unificarem la gestió de tota la xarxa ferroviària de Catalunya, que serà assumida per l’ens públic Infraestructures Ferroviàries de Catalunya.","411",NA
"IFERCAT assumirà la titularitat de la infraestructura, la seguretat ferroviària i les funcions de regulació del trànsit ferroviari, d’assignació de solcs, i de control i supervisió.","411",NA
"•",NA,NA
"Elaborarem un inventari d’infraestructures ferroviàries, equipaments tecnològics i de control d’explotació i del material mòbil, que reculli també una planificació i programació de les actuacions prioritàries que cal abordar per millorar de forma immediata la qualitat del servei.","411",NA
"• Presentarem a l’Estat espanyol una proposta d’acord per mantenir la continuïtat dels serveis amb territoris veïns amb Catalunya.","411",NA
"• Executarem l’Agenda Catalana del Corredor Mediterrani, que inclou els accessos ferroviaris al port de Barcelona, els accessos ferroviaris al port de Tarragona, el tercer fil entre el límit administratiu amb el País Valencia i Castellbisbal, el tercer fil Tarragona - Reus, el tercer fil Figueres - Portbou, les terminals ferroviàries de la llera del riu del port de Barcelona i la de la ZAL del port de Tarragona, la connexió de la terminal de Vilamalla amb l’ample UIC o l’autopista ferroviària Port de Barcelona amb París, Dortmund i Calais. •","411",NA
"Participarem en els òrgans europeus per al desenvolupament del Corredor del Mediterrani, des d’una visió global i europeista, en benefici de les economies de tot l’Arc Mediterrani.","411",NA
"Xarxa viària","H",NA
"Assumirem la titularitat de la xarxa viària que avui gestiona l’Estat espanyol i que presenta una gran varietat de tipologies i formes de gestió (amb peatge o sense, concessionades o de gestió directa, amb contractes de conservació anuals o plurianuals).","301",NA
"Per això: • Reclamarem perquè es faci efectiva l’assumpció dels 1.339 quilòmetres de xarxa de gestió directa no concessionada amb els fons suficients per poder realitzar les inversions necessàries. •","301",NA
"Demanarem el traspàs de la xarxa estatal de les autopistes concessionades.","301",NA
"•",NA,NA
"Impulsarem una agenda d’actuacions per pal·liar la situació de dèficit d’inversió de l’Estat espanyol, per mantenir-la en uns estàndards mínims de servei i seguretat, i resoldre els colls d’ampolla històrics.","411",NA
"• Entre les obres destacades que ens comprometem a executar hi ha la finalització de les obres en curs, com els accessos viaris al port de Barcelona, la variant de Vallirana, la B-40 entre Viladecavalls i Olesa de Montserrat, l’A-2 entre Sils i Maçanet, la N-II entre Vilademuls i Orriols o la finalització de la connexió entre l’A2 i la B-30/AP7.","411",NA
"• També el desdoblament de la N-II a Girona, la N-340 a Barcelona, Tarragona o l’Ebre, el carril bus a la B-23 a Barcelona, l’A-27 entre Valls i Montblanc, la N-240 a Lleida i la N-230 o la N-260 al Pirineu, entre d’altres. •","411",NA
"Traslladarem la circulació dels camions de la N-340 entre l’Hospitalet de l’Infant i Ulldecona a l’Autopista A-7 i també de la N-240 entre Montblanc i Lleida a l’Autopista A-2.","411",NA
"•",NA,NA
"Aplicarem la regulació del transport de viatgers i mercaderies d’abast internacional i de la Unió Europea, amb adhesió als tractats internacionals vigents, així com la normativa espanyola fins a l’adaptació d’un marc normatiu propi.","403",NA
"•",NA,NA
"Proposarem mecanismes de cogestió de les concessions viàries que abracin altres territoris, a més de Catalunya.","411",NA
"Aeroports","H",NA
"El model aeroportuari espanyol és un model altament centralitzat totalment diferent del model implantat en els principals països europeus o als Estats Units, Canadà o Austràlia,","301",NA
"i amb una gestió sotmesa sovint a criteris polítics, pensada més per afavorir alguns aeroports, i que no té en compte criteris de rendibilitat socioeconòmica.","411",NA
"Davant d’aquest fet llargament denunciat: • Implantarem un model de gestió aeroportuària propi i més eficient, amb un impacte més directe sobre l’economia i la població catalana.","411",NA
"És molt important poder comptar amb vols intercontinentals directes, ja que això estimula la capacitat d’internacionalització de l’economia del país,","411",NA
"a més de contribuir a localitzar empreses foranes, especialment les intensives en coneixement.","411",NA
"El nou model aeroportuari establirà polítiques tarifàries pròpies que afavoreixin una millor gestió comercial dels aeroports,","411",NA
"eliminarà les barreres d’entrada de companyies internacionals","407",NA
"i, en definitiva, posarà a disposició de la ciutadania més vols cap a la resta del món.","411",NA
"• Serà un model de gestió individualitzada dels quatre aeroports d’interès general amb seu a Catalunya (Barcelona - el Prat, Girona - Costa Brava, Reus i Sabadell)","411",NA
"i la Generalitat es subrogarà en la posició de l’Estat espanyol en la titularitat d’aquests quatre aeroports i en la posició dels gestors de l’explotació, conservació, direcció i gestió dels serveis aeroportuaris i comercials.","301",NA
"•",NA,NA
"Assumirem les competències estatals en aviació civil, regulació tarifària i de navegació i seguretat aèries i crearem una nova administració aeroportuària encarregada de gestionar aquestes competències.","301",NA
"• Presentarem un inventari de material d’infraestructures i equipaments aeroportuaris i de navegació aèria que constituirà la base de la nova xarxa aeroportuària catalana de gestió pròpia.","411",NA
"Ports","H",NA
"Catalunya ha d’exercir les plenes competències en matèria de ports i costes cosa que afavorirà l’impuls d’un nou model de gestió portuària i costanera","301",NA
"que permeti, d’una banda, captar una major inversió estrangera i fidelitzar els fluxos comercials amb la resta del món","411",NA
"i, de l’altra, actuar de forma coordinada per a la defensa dels fons marítims i l’espai costaner.","501",NA
