"text","cmp_code","eu_code"
"Financiación","H",NA
"El actual modelo de financiación autonómica, vigente desde 2009 y caducado desde 2014, discrimina a los valencianos y valencianas y no nos permite desarrollar nuestras competencias, especialmente en materia social y promoción del empleo.","301",NA
"Por eso es inaplazable reformarlo de manera inmediata.","301",NA
"La propuesta de un nuevo modelo de financiación definida por el grupo de expertos nombrados por el Govern Valencià responde a criterios que permitirían a todas las comunidades autónomas acceder a una financiación equilibrada con las competencias que tiene transferidas;","301",NA
"asegurar que los servicios se puedan prestar en iguales condiciones a toda la ciudadanía, con independencia de su lugar de residencia;","504",NA
"y permitir el ejercicio real de la autonomía de cada comunidad en el desarrollo de sus políticas de ingresos y gastos.","301",NA
"Propuestas","H",NA
"1. Exigiremos al Gobierno del Estado el establecimiento de un calendario para la reforma inmediata del sistema de financiación autonómica, basada en las recomendaciones de los expertos nombrados por el Consell;","301",NA
"así como la aprobación de mecanismos temporales de compensación mientras esta reforma no se produzca.","301",NA
"2. Defenderemos que la reforma inmediata y profunda del sistema de financiación autonómica se produzca con efectos del 1 de enero de 2014 y posibilite así a los valencianos y valencianas disponer de unos servicios públicos fu ndamentales (sanidad, educación, servicios sociales y protección social) de calidad,","504",NA
"y permita, de igual manera, el ejercicio de las competencias propias (empleo, vivienda, medio ambiente, infraestructuras, cultura, promoción económica, etc.) con el fin de alcanzar, al menos, la media de financiación por habitante del conjunto de comunidades autónomas.","301",NA
"3. Propondremos que el nuevo sistema de financiación contemple un tramo a través del cual las administraciones autonómicas puedan desarrollar otro tipo de competencias no básicas.","301",NA
"Este tramo debería poder ser financiado, en buena medida, con tributos propios que recaudara la propia comunidad autónoma o, en caso de insuficiencia fiscal, con transferencias de nivelación.","301",NA
"A través de este mecanismo aseguraríamos una mayor corresponsabilidad fiscal y, al mismo tiempo, un mayor grado de autonomía.","301",NA
"4. Exigiremos el reconocimiento de la deuda histórica desde que se produjeron las transferencias de competencias a la Generalitat Valenciana, cifrada en, por lo menos, 20.000 millones de euros;","301",NA
"así como la definición y el establecimiento de un mecanismo de compensación de estos déficits.","301",NA
"5. Continuaremos desplegando la Agencia Tributaria Valenciana como instrumento para asumir la descentralización de los ingresos y mejorar la eficiencia y la autonomía en la gestión de los tributos propios, aprovechando el conocimiento y la implantación territorial de la Generalitat.","301",NA
"6. Defenderemos una reforma del sistema de financiación de las entidades locales que les garantice un espacio fiscal propio con el que hacer frente a sus competencias y que tenga en cuenta la diversidad del mundo local con vista a una segunda descentralización.","301",NA
"Servicios sociales","H",NA
"La aprobación de la Ley de Servicios Sociales Inclusivos supone crear, estructurar y generar un verdadero Sistema Público de Servicios Sociales que los reconoce como de interés general y esenciales para las personas, y garantiza el ejercicio efectivo de sus derechos fundamentales y un elevado nivel de protección social, que refuerza la cohesión social y territorial.","504",NA
"Recuperamos la centralidad de la persona en todo el sistema, garantizando sus derechos y ofreciendo una atención continuada a lo largo de su ciclo vital, con el acompañamiento de profesionales.","504",NA
"Las políticas inclusivas también incorporan las propuestas en materia de soluciones residenciales y de vivienda pública","504",NA
"y de migración y cooperación internacional, porque son una continuidad de los derechos sociales.","107",NA
"Propuestas","H",NA
"1. Desplegaremos intensamente la nueva Ley de Servicios Sociales Inclusivos, para garantizar los derechos sociales de la ciudadanía.","504",NA
"En este sentido, diseñaremos el Sistema de Información Valenciano en Servicios Sociales, para poder desarrollar la Historia Social Única,","504",NA
"y crearemos el Comité Valenciano de Ética para velar por un funcionamiento profesional y de calidad, con garantías y empatía en los servicios sociales.","504",NA
"2. Potenciaremos e implementaremos el Plan Valenciano de Inclusión y Cohesión Social como hoja de ruta compartida del Govern y la sociedad civil, para garantizar una sociedad más justa, igualitaria y feliz.","504",NA
"3. Regularemos la profesionalización de las personas cuidadoras en el entorno familiar.","504",NA
"4. Pondremos en marcha, en colaboración con las diputaciones provinciales, una red de centros sociales públicos, comarcales, basados en un modelo que fomente la autonomía personal, la solidaridad intergeneracional y evite el desarraigo.","504",NA
"5. Impulsaremos la Estrategia Estatal de Envejecimiento Activo 2020-2025 que incluya, junto a los programas de estancias vacacionales y el termalismo, una programación cultural, deportiva y social que fomente el envejecimiento activo, saludable e inclusivo.","502",NA
"6. Flexibilizaremos la regla de gasto que actualmente se aplica en los ayuntamientos y que dificulta la reinversión de los superávits, para que se puedan destinar recursos a vivienda y alquiler social.","504",NA
"7. Elaboraremos y pondremos en marcha la Ley Valenciana de Accesibilidad Universal, para garantizar los derechos de las personas en su acceso a todos los espacios públicos y privados, entornos naturales, sistemas de transporte, medios de comunicación y servicios de atención a la ciudadanía.","503",NA
"8. Desarrollaremos la Ley para la Función Social de la Vivienda, para hacer efectivo el derecho a una vivienda digna y acabar con los desahucios de las personas más vulnerables de la sociedad.","504",NA
"En esta lí nea, ampliaremos el parque público de viviendas para ponerlo a disposición del alquiler social y del alquiler asequible, de forma que ninguna unidad familiar destine más del 30% de los ingresos.","504",NA
"9. Promoveremos una ley estatal que garantice el derecho a una vivienda digna;","504",NA
"que contemple la regulación del precio del alquiler,","412",NA
"la dación en pago de la primera vivienda,","403",NA
"la destinación de un 30% de la nueva construcción a vivienda protegida, de la cual un 7% irá destinada a alquiler joven;","504",NA
"y que pare los desahucios.","403",NA
"10. Simplificaremos y unificaremos las distintas prestaciones por desempleo de larga duración, como la renta activa de inserción (RAI) y el programa de activación para el empleo (PAE), y lo dotaremos de mayor estabilidad y lo referenciaremos al 60% del SMI.","504",NA
"Además, añadiremos un incremento sobre la prestación del 20% por cada hija o hijo menor de edad,","504",NA
"y facilitaremos la complementariedad con la Renta Valenciana de Inclusión.","504",NA
"11. Continuaremos desplegando la Ley Valenciana de Cooperación y Desarrollo Sostenible y el IV Plan Director de la Cooperación Valenciana para cumplir los compromisos del Pacto Valenciano contra la Pobreza y promover el desarrollo humano sostenible.","107",NA
"Impulsaremos procesos de democratización,","202.1",NA
"buen gobierno,","303",NA
"fomento de la paz","106",NA
"y el respecto de los derechos humanos de las mujeres y de los hombres, que consideran a las personas como titulares de derechos y a las administraciones como titulares de obligaciones.","201.2",NA
"Salud","H",NA
"Consideramos que la salud y el bienestar de las personas son un valor esencial que hay que preservar y promover en todos los ámbitos de la vida.","504",NA
"Lograr este objetivo exige políticas integrales de salud pública que empiecen en las acciones de prevención de daños y de promoción de la salud en el ámbito laboral.","504",NA
"La Generalitat debe liderar de manera efectiva la prevención de los riesgos laborales y la promoción de la salud y el bienestar de la población trabajadora.","701",NA
"Defenderemos la promoción de la salud como modelo útil y necesario para proteger y mejorar la salud de las personas,","504",NA
"y nos comprometemos a reforzar en los entornos de vida, estudio, ocio y trabajo aquellos recursos y activos que contribuyan a mantener la salud individual y colectiva.","504",NA
"Propuestas","H",NA
"1 . Impulsaremos un plan de choque contra las listas de espera, mediante la contratación de más personal sanitario y la mejora de los servicios.","504",NA
"2. Mejoraremos las contrataciones de profesionales sanitarios de atención continuada y de sustituciones, con la creación de las plazas necesarias.","504",NA
"Trabajaremos contra la precariedad en la atención primaria","504",NA
"y aumentaremos la tasa de profesionales de enfermería, para llegar a la media de los estados de la UE.","504",NA
"También reclamaremos al Estado el aumento de las plazas de formación MIR, en especial de MIR pediátrico, para ajustarlas a la demanda real del Sistema Nacional de Salud, con la actualización de los estándares y el diseño de las especializaciones médicas y de enfermería.","504",NA
"3. Comunicaremos completamente los sistemas de historia clínica de primaria y especializada,","504",NA
"y trabajaremos para que se pueda compartir la información de la historia clí nica entre distintos hospitales o departamentos de salud.","504",NA
"4. Incluiremos a los psicólogos en los equipos de atención primaria, como recurso fundamental para desmedicalizar la atención que recibe la ciudadanía.","504",NA
"5. Crearemos centros integrales de atención pediátrica donde se abordarán los trastornos infantiles y juveniles.","504",NA
"En estos centros integraremos los de desarrollo infantil y atención temprana y las u nidades de neurorrehabilitación infantil.","504",NA
"Pondremos orden en el ámbito de la atención al autismo.","504",NA
"6. Reorientaremos la atención a la salud mental hacia un modelo organizativo y de provisión de servicios más comunitario, equitativo, mejor coordinado, mejor gobernado, accesible, de calidad, eficaz y eficiente.","504",NA
"7. Continuaremos con la reversión de los servicios y la recuperación de las concesiones administrativas de departamentos sanitarios privatizadas, para garantizar un servicio público y de calidad.","504",NA
"8. Estudiaremos la ampliación de las prestaciones sanitarias a ámbitos como son odontología, nutrición, podología, prótesis, psicología, fisioterapia, estomatología y otras disciplinas de las ciencias de la salud.","504",NA
"9. Garantizaremos el derecho de las mujeres a elegir el hospital en el que serán atendidas durante el parto y a ser informadas de todas las intervenciones sanitarias que se les propongan.","504",NA
"10. Propondremos en el Congreso la promulgación de la Ley de Muerte Digna y de Atención Sanitaria al Final de la Vida.","604",NA
"11. Impulsaremos una política decidida de prevención y detección de las infecciones de transmisión sexual, con la multiplicación de recursos de atención y la implementación de las pruebas rápidas.","504",NA
"12. Pondremos en marcha medidas específicas para la prevención de la ludopatía","504",NA
"y restringiremos la publicidad del juego en línea,","403",NA
"y regularemos la instalación y el funcionamiento de las casas de apuestas.","403",NA
"Educación","H",NA
"La educación es la mejor herramienta para transformar la sociedad, generar opor-tunidades y ayudar a red ucir las desigualdades.","506",NA
"El sistema educativo debe adecuarse al alumnado y a la pluralidad de la sociedad valenciana y tiene que encontrar las respuestas educativas en los retos que se nos plantean.","506",NA
"La diversidad del alumnado y de las familias y las nuevas causas de exclusión social hacen que los centros educativos tengan que asumir la inclusión y la atención específica del alumnado como una tarea básica y fundamental de su día a día.","506",NA
"Así mismo, la administración educativa debe proporcionar las herramientas, los recursos y crear los contextos necesarios para hacerlo posible, y facilitar las estrategias pedagógicas que conviertan estos retos en oportunidades de mejora de todo el sistema.","506",NA
"Propuestas","H",NA
"1. Aumentaremos la oferta pública de Educación Infantil del nivel 2-3 años en centros públicos de educación infantil y primaria","506",NA
"y seguiremos ampliando la oferta gratuita de plazas 0-3 en las escuelas infantiles en todo el territorio.","506",NA
"2. Seguiremos bajando la ratio en todos los niveles y enseñanzas y recuperaremos la jornada lectiva del profesorado de 18 horas de docencia directa en enseñanza secundaria y bachillerato y de 23 horas en enseñanza infantil y primaria.","506",NA
"Así mismo, impulsaremos la mejora continuada de las condiciones económicas y laborales de los equipos docentes valencianos.","701",NA
"3. Haremos gratuitos los comedores escolares durante la legislatura, con un proyecto integral como espacio de socialización en igualdad,","506",NA
"donde se fomente una alimentación saludable, sostenible y de proximidad, que, además, potencie el producto de proximidad y ecológico.","416.2",NA
"4. Seguiremos aumentando las plazas de profesorado generalista y específico","506",NA
"y mejoraremos la gestión del personal, asumiendo la Conselleria competente en educación la gestión de aquellos profesionales que trabajen en los centros educativos y que ahora dependen de la Conselleria de Justicia.","506",NA
"5. Profundizaremos en el programa de oferta rural: un pueblo, una escuela.","506",NA
"Potenciaremos equipos docentes que dan continuidad a los proyectos educativos en coherencia con el medio, de forma que la escuela rural sea también un núcleo de irradiación de cultura y un espacio de socialización del municipio.","506",NA
"Garantizaremos el servicio de transporte escolar en las zonas rurales.","506",NA
"Facilitaremos la agrupación de centros rurales y los dotaremos de los recursos necesarios que les faciliten la organización de acuerdo con su singularidad.","506",NA
"6. Integraremos las áreas de formación profesional y de empleo para contribuir al cambio de modelo productivo, mejorar la empleabilidad de la gente, la calidad del trabajo y para que el mundo empresarial valenciano pueda contar con más personal cualificado.","411",NA
"La formación profesional del alumnado estará en consonancia con las necesidades de nuestras empresas y aprovecharemos de forma más eficiente todos los recu rsos de formación.","411",NA
"7. Después de haber doblado el presupuesto en becas universitarias durante la pasada legislatura, pondremos en marcha un nuevo sistema de tasas universitarias relacionado directamente con los ingresos de forma progresiva, tanto para títulos de grado como para títulos de máster, de forma que ninguna persona tenga que renunciar a los estudios universitarios por razones económicas.","506",NA
"8. Pondremos en marcha un Instituto Valenciano de la Investigación y Estudios Avanzados para sacar adelante nuevas fórmulas que nos permitan competir en igualdad con otros sistemas de investigación, mediante la colaboración con las universidades valencianas","411",NA
"y la contratación indefinida de los investigadores que se hayan beneficiado del programa GENT, que aportarán un mayor retorno a la sociedad valenciana.","411",NA
"Cultura y deporte","H",NA
"La puesta en marcha del Plan FesCultura 2016-2020 ha supuesto un cambio radical en las políticas públicas en materia de cultura.","502",NA
"Por primera vez hay una estrategia compartida entre la Generalitat y los sectores culturales para la transformación del ecosistema cultural valenciano a través de la mejora de los derechos culturales de la ciudadanía, de la expresión, de la participación y de la construcción de las identidades individuales y colectivas,","502",NA
"además de incrementar la innovación y la productividad de la cultura para que conlleve un valor añadido y genere puestos de trabajo de calidad.","502",NA
"El compromiso presupuestario progresivo es el camino para esta recuperación del sector.","502",NA
"Al mismo tiempo, apostamos por que el deporte sea un elemento de cohesión social, reductor de desigualdades y generador de salud.","502",NA
"Propuestas","H",NA
"1. Crearemos la campaña “Elige un libro” para impulsar los hábitos de lectura a través de las librerías: regalaremos un libro a cada niño/a al cumplir 6 años","502",NA
"y profundizaremos en el plan de fomento del libro y la lectura que ya hemos iniciado.","502",NA
"2. Impulsaremos una plaza virtual de encuentro (Market Place) entre creativos de contenidos, productores de contenidos y exhibidores de contenidos para intercambiar talentos, contenidos, conocimientos y know-how.","502",NA
"3. Elaboraremos la Ley de las Artes Escénicas Valencianas que impulsará la formación y el acompañamiento para compañías de artes escénicas en cuestiones relativas a mecenazgo, gestión, comunicación e internacionalización;","502",NA
"crearemos centros de referencia escénica como espacios de investigación y experimentación de las nuevas dramaturgias;","502",NA
"promoveremos nuevas relaciones para consolidar programas de residencia, movilidad e intercambio con otros centros territoriales del mundo,","502",NA
"y estableceremos un programa plurianual de ayudas.","502",NA
"4. Crearemos espacios culturales en las ciudades de Alicante y Castelló siguiendo el modelo de éxito del Centre de Cultura Contemporània del Carme (CCCC), situado en València, como universos de promoción, producción, investigación y residencia cultural.","502",NA
"5. Impulsaremos, en colaboración con los ayuntamientos, el programa Patrimonio Edificante.","502",NA
"Para ello delegaremos las competencias necesarias y dotaremos económicamente a los ayuntamientos valencianos que se adhieran al plan, para impulsar el patrimonio cultural valenciano en todo el territorio.","502",NA
"6. Aprobaremos el Estatuto de la Música para dar respuesta a la falta de adecuación de la reglamentación existente en materia laboral y jurídica, así como a las necesidades de las distintas profesiones de la música valenciana.","502",NA
"7. Crearemos un Centro de Alto Rendimiento Deportivo en el territorio valenciano.","502",NA
"8. Pondremos en marcha el Plan Estratégico del Deporte en el que se ha estado trabajando y redactando con la participación del sector durante esta legislatura.","502",NA
"9. Crearemos un programa de asesoramiento y de atención a deportistas de élite no profesionales y exprofesionales, tanto en lo relativo a la vertiente académica y formativa como a la inserción laboral, durante su trayectoria deportiva y los años posteriores.","502",NA
"10. Aumentaremos las ayudas a la construcción y reforma de infraestructuras deportivas municipales establecidas en la actual legislatura.","502",NA
"Empleo","H",NA
"Estos últimos años hemos experimentado transformaciones económicas estructurales que han modificado el mercado de trabajo: la globalización y la extensión de las nuevas tecnologías, la automatización y la precarización.","701",NA
"También hemos experimentado, sin embargo, la inclusión en el debate de la sostenibilidad ambiental, la perspectiva de género, la inclusión social y la conciliación, entre otros.","416.2",NA
"Hace falta aplicar medidas concretas para generar empleo estable y de calidad, que reduzcan la tasa de paro sin caer en una precariedad que afecte a las capas más vulnerables de la sociedad.","701",NA
"Las personas, sus oportunidades y su bienestar tienen que estar en el centro de las políticas de empleo.","701",NA
"Propuestas","H",NA
"1. Elaboraremos una Ley Valenciana de Empleo que estructure todo el sistema de agentes e instituciones que intervienen en materia de políticas de empleo y desarrollo territorial.","701",NA
"2. Propondremos el establecimiento, a nivel estatal, de la jornada laboral de 32 horas como instrumento para la creación de empleo.","701",NA
"Mientras tanto, desde la Generalitat pondremos en marcha un programa de ayudas para empresas que quieran, voluntariamente, reducir su jornada laboral, manteniendo los salarios y creando nuevos puestos de trabajo.","701",NA
"3. Trabajaremos contra la precariedad mediante ayudas y programas específicos que subvencionen la contratación estable y de calidad.","701",NA
"4. Impulsaremos un programa de control y sanciones para evitar las horas extra no remuneradas.","701",NA
"5. Incidiremos en la incorporación de la perspectiva de género en todos los programas de empleo como herramienta para facilitar la inclusión sociolaboral de las mujeres.","503",NA
"6. Intensificaremos las campañas de inspección y prevención de la economía irregular, principalmente en aquellos sectores con más incidencia y en los que las mujeres se ven más afectadas.","403",NA
"Introduciremos sesiones formativas en derechos laborales dirigidas al alumnado de las últimas etapas obligatorias.","701",NA
"7. Derogaremos las reformas laborales desarrolladas por los gobiernos del PP y el PSOE,","701",NA
"y promoveremos un nuevo marco laboral que recupere los derechos de las personas trabajadoras para impulsar una economía sostenible.","416.2",NA
"8. Impulsaremos políticas de reconocimiento de los derechos de las personas trabajadoras del hogar, exigiendo la ratificación del Convenio 189 de la Organización Internacional del Trabajo.","701",NA
"9. Exigiremos el traspaso de la inspección de trabajo a aquellas comunidades autónomas que lo pidan, con el establecimiento de mecanismos de coordinación en el ámbito estatal.","301",NA
"Medio ambiente","H",NA
"El cambio climático es el reto más grande al que debemos hacer frente como sociedad en las próximas décadas.","501",NA
"Urge la necesidad de reducir las emisiones de gases de efecto invernadero para evitar escenarios de cambio climático catastrófico.","501",NA
"Tenemos que actuar en una doble vía: ir hacia una producción y un consumo más responsable con el medio ambiente","416.2",NA
"y desarrollar estrategias de bienestar basadas en reducir el consumo de recursos naturales y de energía,","416.2",NA
"conservar y recuperar los espacios forestales, fluviales y agrarios y su biodiversidad,","501",NA
"así como en la distribución justa de los costes y beneficios de esta transición ecológica necesaria e inaplazable.","416.2",NA
"En este sentido es clave el alineamiento de energía, clima y políticas ambientales con el objetivo de acelerar la transición a una economía sostenible, circular y competitiva.","416.2",NA
"Propuestas","H",NA
"1. Aprobaremos una nueva Ley de Protección de Espacios Naturales para desarrollar y adaptar a la realidad valenciana la normativa europea y estatal vigente en materia de patrimonio natural, biodiversidad, conservación de los ecosistemas acuáticos y espacios protegidos por sus altos valores ecológicos.","501",NA
"2. Ampliaremos la red de espacios naturales protegidos de la Comunidad Valenciana con la creación de los parques naturales de El Caroig, de Aitana y de Serra Escalona,","501",NA
"e impulsaremos la declaración del Parque Natural de la Albufera como Reserva de la Biosfera en colaboración con las diversas administraciones públicas, los actores sociales, económicos y ambientales y las poblaciones involucradas en estos espacios naturales.","501",NA
"3. Fortaleceremos el despliegue y la aplicación de las Líneas Estratégicas para la Prevención de Incendios Forestales,","501",NA
"así como la colaboración y coordinación entre administraciones para la prevención y la extinción de incendios forestales,","501",NA
"y reforzaremos la implementación de los planes municipales de prevención de incendios forestales.","501",NA
"4. Pondremos en marcha un Fondo Forestal Valenciano como instrumento para que los propietarios y los municipios que gestionan sus bosques de manera sostenible reciban una compensación que incentive estas prácticas y que reconozca aquello que los terrenos forestales ofrecen a la sociedad.","416.2",NA
"5. Desplegaremos el nuevo Plan Integral de Residuos, una política de gestión de residuos coordinada entre las administraciones, transparente e integrada, basada en la reducción, la reutilización, la recogida selectiva y el reciclaje y la valorización de los materiales.","416.2",NA
"6. Exigiremos al Gobierno central un calendario de cierre definitivo de la central nuclear de Cofrents al final de la actual prórroga de funcionamiento, en marzo de 2021;","416.2",NA
"así como la elaboración de un plan de contingencia social y económica del área de influencia socioeconómica de la central y del abastecimiento eléctrico postcierre.","416.2",NA
"7. Elaboraremos una Ley de Transición Hidrológica, basada en la aplicación de la Directiva Marco del Agua (DMA) para recuperar y conservar el buen estado de los ríos, acuíferos, lagos, estuarios y aguas costeras;","501",NA
"para garantizar el uso sostenible del agua en cada cuenca;","416.2",NA
"para garantizar la aplicación de medidas de mitigación y adaptación a los efectos del cambio climático;","501",NA
"y para reconocer y garantizar el ejercicio del derecho humano esencial de acceso al agua potable y el saneamiento a todas las personas.","501",NA
