"text","cmp_code","eu_code"
"8. Finalizaremos las obras complementarias en el trasvase Júcar-Vinalopó para permitir la plena operatividad de esta infraestructura con el fin de satisfacer los usos agrarios del Vinalopó y revertir la sobreexplotación de los acuíferos.","703.1",NA
"9. Promoveremos que desde las confederaciones hidrográficas se elaboren planes de recuperación ecológica, socioeconómica y patrimonial de las principales cuencas fluviales que atraviesan el País Valenciano empezando por las cuencas del Júcar, Vinalopó, Segura, Turia, Palancia, Millares y Serpis, en colaboración con las autoridades autonómicas y municipales, contando con la participación de la población y de todas las partes interesadas.","416.2",NA
"10. Aprobaremos una ley para garantizar la dignidad y el bienestar animal.","501",NA
"Apoyaremos a las entidades locales para los planes de esterilización felina y la atención de los animales abandonados con sacrificio cero, en colabora-ción con las asociaciones protectoras de animales.","501",NA
"11. Promoveremos la reducción del IVA de los servicios veterinarios.","501",NA
"Territorio","H",NA
"El modelo territorial que necesitamos es un modelo de protección del territorio y de las personas.","501",NA
"Nos hace falta un urbanismo mediterráneo, sostenible, que recupere y refuerce las poblaciones compactas, muy equipadas y dotadas, con servicios y comercios de proximidad y plena accesibilidad, en vez de potenciar un urbanismo disperso, de baja densidad, con separación de actividades y urbanizaciones cerradas, derrochador de suelo y de recursos, y generador de tráfico y de graves problemas económicos y ambientales.","416.2",NA
"Al mismo tiempo, hay que enfrentarse con medidas concretas y eficientes al grave problema de despoblamiento que sufren muchas comarcas valencianas de interior, que hipoteca el futuro de buena parte de nuestro territorio y de su gente.","416.2",NA
"Propuestas","H",NA
"1. Desplegaremos intensamente la nueva Ley de Urbanismo para promover un modelo territorial al servicio de las personas, que nos permita un futuro sostenible y que no deprede el medio ni especule con el suelo.","416.2",NA
"2. Adaptaremos las ciudades y pueblos al cambio climático, con el estudio de su funcionamiento bioclimático,","501",NA
"y diseñaremos programas de reintroducción de arbolado y espacios verdes ajardinados en las ciudades, con el fin de mitigar el efecto isla de calor.","501",NA
"3. Impulsaremos en el Estado la promulgación de leyes de protección del territorio, siguiendo la filosofía de las ya promulgadas en las Corts Valencianes.","501",NA
"4. Impulsaremos la reforma de la Ley 7/1985 Reguladora de Bases del Régimen Local y el resto de normativa en materia de régimen local para permitir que las comunidades autónomas puedan eliminar las diputaciones provinci-ales y diseñar su propia estructura de gobierno territorial.","303",NA
"Mientras tanto, continuaremos trabajando en la coordinación y vaciado de competencias de las diputaciones y promoveremos la agrupación de entidades locales, como las comarcas, mancomunidades o áreas metropolitanas, priorizando la proximidad a la ciudadanía en la toma de decisiones y la eficiencia en la prestación de servicios.","303",NA
"5. Desarrollaremos una Estrategia Valenciana de Desarrollo Rural Sostenible con el objetivo de revertir el despoblamiento y mejorar la calidad de vida de las personas que viven en las zonas rurales;","416.2",NA
"incrementando las rentas y puestos de trabajo,","701",NA
"fomentando el trabajo autónomo, la creación de pymes y cooperativas y el teletrabajo;","402",NA
"promoviendo actividades económicas sostenibles y nuevas actividades innovadoras y de bajo impacto territorial;","416.2",NA
"incorporando incentivos fiscales y económicos","402",NA
"y mejorando las dotaciones y servicios públicos, de comunicación y financieros.","504",NA
"6. Crearemos un fondo específico para promover el desarrollo rural integral gestionado desde la Agencia Valenciana de Promoción Rural y Lucha contra el Despoblamiento.","410",NA
"7. Impulsaremos la Ley de Servicios Sociales en el Mundo Rural (sanidad, educación, servicios sociales, movilidad y conectividad).","504",NA
"Es necesario romper con el círculo vicioso de la despoblación invirtiendo en servicios públicos que atraigan población que busca en el entorno rural una mejor forma de vida.","504",NA
"8. Avanzaremos decididamente hacia un modelo de movilidad basado en premisas de sostenibilidad, eficiencia energética, integración social, mejora de la seguridad vial y de la salud, dando prioridad al transporte público.","416.2",NA
"9. Abordaremos un nuevo enfoque de las inversiones en infraestructuras de movilidad y transporte, priorizando la mejora de los servicios de cercanías, de los ferrocarriles regionales, autonómicos, carriles bici, carriles bus y VAO de acceso a las ciudades,","411",NA
"así como en las inf raestructu ras que permitan la rápida electrificación del transporte.","411",NA
"10. Exigiremos al Estado una inversión adecuada para dignificar las infraestructuras en nuestro territorio, con especial hincapié a la red de cercanías, el corredor mediterráneo, el tren Gandia-Dénia, las mejoras de la vía Xàtiva-Alcoi, la doble lí nea ferroviaria allí donde todavía no haya y el túnel pasante en la ciudad de València.","411",NA
"11. Impulsaremos el traspaso a la Generalitat de las competencias del tren de cercanías y de todos los transportes que operan con red autonómica.","301",NA
"Promoveremos acuerdos entre comunidades para la potenciación de las líneas que las interconectan (Castilla-La Mancha, Aragón, Cataluña, Murcia).","411",NA
"El traspaso deberá ir acompañado de un plan de inversiones del Estado para la mejora, reparación y modernización de las líneas y el material.","411",NA
"12. Exigiremos la gratuidad total de la AP-7","411",NA
"y la adecuación urgente de los accesos en las distintas comarcas.","411",NA
"13. Mejoraremos el transporte colectivo, priorizando los vehículos de menores emisiones: tranvía, trolebús, autobuses a gas, híbridos y eléctricos, siempre teniendo en cuenta los criterios de eficiencia y de ajuste a la demanda real.","416.2",NA
"14. Potenciaremos el transporte público en entornos rurales como herramienta de cohesión social y territorial y de lucha contra el despoblamiento.","411",NA
"Modelo económico","H",NA
"Caminamos hacia nuevo modelo económico basado en la sostenibilidad económica, medioambiental y social;","416.2",NA
"en la planificación y la participación ciudadana;","202.4",NA
"en la ética y la cooperación,","606.1",NA
"y en el que la economía y el trabajo son instrumentos al servicio del bienestar de las personas.","416.2",NA
"En este sentido, se debe considerar la modernidad, las nuevas tecnologías y la automatización al servicio de un modelo económico que no pasa por trabajar y consumir más, sino menos y mejor.","416.2",NA
"Queremos una economía para las personas, que priorice su bienestar, su autorreal-ización y el progreso de la sociedad en su conjunto;","416.2",NA
"una economía para la transición ecológica, que sea sostenible, respetuosa con el entorno y que sitúe los sectores productivos valencianos en la vanguardia de la transición ecológica de la economía;","416.2",NA
"una economía avanzada y conectada, que promueva la innovación y permita a los sectores productivos mejorar hacia el servicio de las personas,","411",NA
"y una economía femi-nista, que incorpore la perspectiva de género y la apuesta por nuevos sectores como la cultura o los cuidados.","503",NA
"Propuestas","H",NA
"1. Desarrollaremos el Plan Estratégico de la Industria Valenciana (PEIV) y lo ampliaremos a nuevos clústeres emergentes y potenciales, sobre los criterios de sostenibilidad,","416.2",NA
"y potenciaremos y pondremos en valor sectores productivos como la ganadería, la química verde, la cultura y el sector audiovisual, la artesanía o la prestación de servicios de cuidados.","410",NA
"2. Impulsaremos programas específicos para apoyar a las pymes industriales, que contarán con las necesidades de financiación productiva y de inversiones, para la transformación digital, la incorporación de I+D+i, la diversificación productiva y la internacionalización.","402",NA
"Tam bién trabajaremos a nivel estatal para crear un Plan Integral de apoyo especial a las pymes y microempresas, por su importancia para la disminución del desempleo.","402",NA
"Facilitaremos el acceso al crédito de las pequeñas empresas que sean económicamente viables.","402",NA
"3. Promoveremos una Ley de Institutos Tecnológicos que dote de estabilidad al sector y de un espacio de colaboración a largo plazo.","411",NA
"Crearemos una Escuela de Innovación que ayudará a nuestras pymes a introducir nuevos procesos, nuevas maneras de organizarse y principios de gestión avanzada para que puedan ganar productividad.","411",NA
"4. Potenciaremos, en coordinación con las empresas tecnológicas que operan en nuestro territorio, un rápido despliegue de la Red 5G y la extensión de su cobertura a todo el territorio, para estar al frente de las regiones de Europa en el impulso a la economía del conocimiento.","411",NA
"5. Desarrollaremos la Ley de Gestión, Modernización y Promoción de Áreas Industriales y el Mapa del Suelo Industrial del IVACE para la modernización y mejora de los servicios y dotaciones de los polígonos industriales y la generación de un contexto industrial competitivo.","411",NA
"6. Fomentaremos las cooperativas y la economía social para impulsar un cambio en el modelo productivo basado en valores democráticos, participativos, igualitarios y sostenibles.","403",NA
"Promoveremos las fórmulas cooperativas para el emprendimiento y para la recuperación, por parte de los trabajadores y trabajadoras, de empresas en proceso de quiebra.","403",NA
"7. Defenderemos los productos industriales propios contra la competencia desleal de los productos extracomunitarios, promoviendo una legislación europea adecuada (mayor control de los productos perniciosos y nocivos en el consumo, de los fabricados con trabajo infantil o cuasiesclavitud, de los generadores de contaminación en su producción, etc.), acompañada de medidas que posibiliten su aplicación.","406",NA
"8. Pondremos en marcha un programa integral de fomento del emprendimiento con el objetivo de facilitar un apoyo eficaz a la creación de empresas y crear un entorno más favorable para poner en marcha y desarrollar los proyectos, con instrumentos de asesoramiento y seguimiento en todas las fases de la puesta en marcha y durante los primeros años de vida de la empresa.","402",NA
"9. Construiremos un gran acuerdo transversal del Gobierno con la sociedad: Acuerdo Valenciano para la Transición Energética, para proponer y compartir una hoja de ruta hacia la transición energética con el objetivo de llegar al año 2050 con un 100% de renovables en el sector eléctrico, logrando también capacidad y soberanía para conseguirlo y alinear los otros sectores (transporte, agricultura, industria ...) con los objetivos de la UE.","416.2",NA
"10. Apoyaremos al pequeño y mediano comercio a través de los planes de ayudas Avalamos Comercio y Emprendemos Comercio,","402",NA
"el Plan de Impulso al Comercio Electrónico,","411",NA
"la profesionalización del sector comercial a través de la formación y la acreditación de las competencias profesionales","411",NA
"y el fomento del consumo del producto de proximidad y tradicional.","403",NA
"11. Impulsaremos la Ley Estatal de Regulación de los Horarios Comerciales para favorecer la conciliación familiar y la protección del comercio de proximidad.","403",NA
"12. Ante la finalización de la concesión en la próxima legislatura, trabajaremos para devolver a la gestión pública directa el servicio de las Inspecciones Técnicas de Vehículos (ITV), con la total prioridad de salvaguardar la seguridad vial en las carreteras valencianas, la mejora en la calidad del servicio, la rebaja de las tarifas para las personas usuarias y una gestión transparente y eficiente.","411",NA
"13. Colaboraremos con los municipios para que apliquen la nueva Ley de Turismo y regulen y delimiten los recursos turísticos a través de la ordena-ción urbanística;","403",NA
"y facilitaremos apoyo técnico, en especial a los municipios pequeños, para elaborar un Plan de Ordenación de los Recursos Turísticos (PORT).","403",NA
"14. Actualizaremos el Registro de Turismo de la Comunidad Valenciana para que la totalidad de los apartamentos turísticos cumplan la normativa urbanística municipal","403",NA
"y vigilaremos el cumplimiento de la obligación de las plataformas digitales de alojamiento de hacer constar el número de inscripción en todas las ofertas.","403",NA
"Así mismo, aumentaremos la inspección y la lucha contra el intrusismo.","403",NA
"15. Estudiaremos la creación de un fondo de sostenibilidad turística que ayude a mitigar los efectos negativos sociales y medioambientales que puede producir la presión turística en zonas de máxima afluencia, financiado con figuras fiscales suficientes y proporcionales.","416.2",NA
"16. Mejoraremos las condiciones laborales y la seguridad laboral de los trabajadores y las trabajadoras del sector turístico, en particular de los colectivos que más sufren la precariedad laboral, como las “kellys”,","701",NA
"y atenderemos los fenómenos de la externalización de servicios y de los “falsos autónomos”.","403",NA
"17. Impulsaremos un Plan de Turismo Rural en comarcas de interior, que apoye las modalidades que más se adecuan al entorno cultural y ambiental, minimizando impactos y creando efectos socioeconómicos sinérgicos con las potencialidades del territorio.","416.2",NA
"Un eje transversal principal del Plan será el empoderamiento de las mujeres en el medio rural, como agente de desarrollo económico y generador de nueva riqueza y de puestos de trabajo en las comarcas rurales.","503",NA
"Agricultura","H",NA
"La agricultura, la ganadería, la pesca y el desarrollo rural constituyen una parte fun-damental de nuestra economía, de nuestro paisaje y de nuestra manera de entender el mundo.","703.1",NA
"Las personas tienen que poder vivir del campo, por eso la aplicación de políticas encaminadas a su sostenibilidad es fundamental para garantizar un territorio con futuro y que a su vez genere oportunidades laborales dignas.","703.1",NA
"Las condiciones naturales del País Valenciano han consolidado a lo largo del tiempo un sector económico clave y potente como es el agroalimentario, esencial y es-tratégico para nuestra comunidad a muchos niveles: político, territorial, económico, social y ambiental.","703.1",NA
"El amor por la tierra implica un sentimiento común de defensa del territorio.","703.1",NA
"Propuestas","H",NA
"1. Impulsaremos la Ley para las Elecciones en el Campo Valenciano y el Consejo Agrario Valenciano, como órgano consultivo de la Conselleria, con representación de las organizaciones profesionales agrarias más representativas.","703.1",NA
"Además, promoveremos el Consejo Agroalimentario Valenciano: un instrumento de participación y consulta con presencia de las entidades representativas en el ámbito del mundo rural y la cadena alimentaria.","703.1",NA
"2. Mejoraremos el modelo de servicio del sector agrario, mediante la reactivación de las oficinas comarcales como oficinas de atención y promoción del sector primario valenciano, desarrollando un papel impulsor y promotor del sector agroalimentario y del medio rural valenciano.","703.1",NA
"3. Incorporaremos especialistas en materia agraria a la Oficina de la Comunidad Valenciana en Bruselas, nexo de la Generalitat Valenciana con la UE y los subsectores agrarios valencianos, referencia y vehículo para la vertebración de los subsectores agrarios valencianos, con el objeto de articular un lobby valenciano real a las instituciones comunitarias.","703.1",NA
"4. Impulsaremos una estrategia para la industria agroalimentaria valenciana basada en el producto de proximidad, de calidad y ecológico, priorizando la financiación de inversiones y/o nuevos proyectos que den valor a la cadena.","703.1",NA
"5. Elaboraremos una Ley Valenciana de Estructuras Comerciales que unifique la legislación actual e incorpore una nueva regulación sobre mercados locales y de proximidad, así como medidas de mejora de la competitividad.","403",NA
"6. Impulsaremos iniciativas para la conversión de la agricultura de secano y la ganadería extensiva hacia la producción ecológica, que tendrá que contemplar medidas económicas y fiscales, medidas de I+D+i y de formación continuada e instrumentos de financiación.","703.1",NA
"7. Implementaremos la Ley de Estructuras Agrarias de la Comunidad Valenciana, que favorecerá la viabilidad y racionalidad de las explotaciones agrarias, manteniendo la biodiversidad de los agrosistemas, bienes patrimoniales y todos aquellos factores de diferenciación que vayan en beneficio de la calidad agroalimentaria.","703.1",NA
"8. Promoveremos la Ley de Pastoreo Racional, en la que se reconozca su valor ambiental, con el equilibrio de las cargas ganaderas a nuestras montañas, y se garanticen los servicios necesarios para la trashumancia, la transtermitancia y el pasto.","703.1",NA
"9. Desarrollaremos la Ley de Pesca Marítima y Acuicultura para promover la diversificación de la actividad pesquera, el paro biológico y el fomento de la gastronomía y el turismo de este sector primario.","416.2",NA
"10. Presentaremos el Plan Director Citrícola de la Comunidad Valenciana (2019- 2023), con el objetivo de mejorar la posición competitiva de la citricultura valenciana.","703.1",NA
"11. Defenderemos que la agroalimentación quede fuera de los acuerdos comerciales extracomunitarios para proteger la seguridad fitosanitaria y alimentaria de nuestras producciones, la soberanía alimentaria y el futuro del mundo agrario y su desarrollo rural; así como todos los servicios ecosistémicos que aporta al conjunto de la UE.","703.1",NA
"12. Reclamaremos al Gobierno del Estado que recupere las tasas de inversión presupuestaria para realizar políticas efectivas de mantenimiento y defensa de los recursos agrarios, ganaderos, forestales y pesqueros.","703.1",NA
"Derechos de la ciudadanía","H",NA
"Desde Compromís hemos conseguido que la lucha contra la corrupción, para recuperar la credibilidad de la política y la regeneración democrática, se haya convertido en un eje estratégico de la Generalitat y su acción política.","304",NA
"Debemos seguir avanzando para garantizar los derechos de ciudadanía, que en este momento son múltiples y que pasan por garantizar desde una infancia digna hasta la memoria democrática.","201.2",NA
"Unos derechos que garanticen la protección de la diversidad como valor, desde la religiosa hasta la sexual, pasando por la étnica.","607.1",NA
"Unos derechos de ciudadanía que reclaman una administración eficiente y centrada en las personas.","303",NA
"Propostes","H",NA
"1. Impulsaremos una Ley de Gobierno Abierto, que abra las puertas de la administración a la ciudadanía,","202.4",NA
"que fomente su participación en la toma de decisiones","202.4",NA
"y que garantice la transparencia en la gestión del dinero público.","304",NA
"2. Tal como hemos hecho en el gobierno valenciano, impulsaremos en el Estado la aprobación del código ético de buen gobierno","304",NA
"y también la regulación de la actividad de los lobbies o grupos de presión, garantizando la transparencia en la participación de los grupos de interés en la toma de decisiones de políticas públicas y en la elaboración de proyectos normativos, siempre de acuerdo con los principios de legalidad, publicidad, transparencia, rendición de cuentas y responsabilidad en la gestión pública.","304",NA
"3. Pondremos en marcha una unidad de los servicios jurídicos de la Generalitat para recuperar el dinero robado por las tramas de corrupción.","304",NA
"4. Potenciaremos los sistemas de alerta para detectar posibles irregularidades en cualquier procedimiento de contratación pública,","304",NA
"e impulsaremos estas mismas medidas en la Administración Central del Estado.","304",NA
"También dotaremos de un nuevo impulso a la Agencia de Prevención y Lucha contra el Fraude y la Corrupción de la Comunidad Valenciana.","304",NA
"5. Desplegaremos la Ley Valenciana de Fomento de la Responsabilidad Social para garantizar que se incluyan cláusulas éticas y sociales en la contratación y las subvenciones públicas a empresas y entidades.","403",NA
"6. Plantearemos las reformas legales necesarias para garantizar el reconocimiento de la capacidad de la Genera litat Valenciana de legislar sobre el Derecho Civil propio, sin interferencias por parte del Estado, tal como reconoce el Estatuto de Autonomía.","301",NA
"7. Volveremos a proponer una reforma de la Ley Electoral Valenciana para hacerla más democrática, más moderna y más representativa, y acabar con la valla del 5%.","202.1",NA
"Una ley que fomente la paridad entre mujeres y hombres","503",NA
"y facilite el voto preferencial a la ciudadanía.","202.1",NA
"8. Impulsaremos el Servicio de Justicia Gratuita como derecho constitucional de la ciudadanía por medio de la dignificación del trabajo de los letrados, unas retribuciones dignas y una formación continua.","504",NA
"9. Democratizaremos el sistema de acceso a la carrera judicial y fiscal con un sistema de becas que premie la capacidad y no la situación económica de la persona aspirante.","504",NA
"10. Garantizaremos que la formación especializada en materia de género sea obligatoria y evaluable en las oposiciones a judicatura, la Escuela Judicial y la formación continua anual, impartida por el Consejo General del Poder Judicial;","503",NA
"y también para los jueces y juezas ya en activo.","503",NA
"11. Seguiremos desarrollando la Ley Valenciana de Memoria Democrática y por la Convivencia.","202.1",NA
"En el Estado Español, entre otras iniciativas, se confeccionará un censo de víctimas y se elaborarán mapas de las zonas del territorio en las cuales se presuma que puedan localizarse restos de víctimas desaparecidas durante la Guerra Civil y la dictadura.","201.2",NA
"12. Garantizaremos que todas las personas sean atendidas por las administraciones públicas en igualdad de condiciones en cualquiera de las lenguas oficiales.","303",NA
"13. Impulsaremos una Ley Valenciana de Igualdad de Trato, No Discriminación y Prevención de los Delitos de Odio.","503",NA
"14. Desarrollaremos la Ley Integral del Derecho a Ia Identidad y Expresión de Género y la Ley de Igualdad de las Personas LGTBI y velaremos por su cum-plimiento.","503",NA
"Así mismo, impulsaremos una ley estatal para el pleno reconocimiento de los derechos LGTBI.","503",NA
"15. Derogaremos la Ley de Protección de la Seguridad Ciudadana, conocida como Ley Mordaza, porque es una norma lesiva para la libertad de expresión y otros derechos ciudadanos.","605.2",NA
"16. Impulsaremos la Ley Valenciana de Diversidad Familiar y Apoyo a las Familias.","504",NA
"17. Promoveremos un pacto por unos nuevos usos del tiempo, basado en la corresponsabilidad y el fomento de la crianza familiar,","503",NA
"la redistribución del trabajo,","503",NA
"el reconocimiento del ocio educativo","502",NA
"y el respeto hacia nuestro medio ambiente.","501",NA
"18. Crearemos la Oficina Valenciana de Personas Refugiadas como servicio de atención a las personas refugiadas y solicitantes de asilo, con asesoramiento legal y acompañamiento en su inclusión en la sociedad valenciana.","201.2",NA
"19. Exigiremos el cierre inmediato de los CIE,","201.2",NA
"así como una política migratoria más solidaria, que incluya el cumplimiento de las cifras de acogida de personas refugiadas aprobadas internacionalmente.","201.2",NA
"20. Daremos preferencia a la titularidad pública y la gestión directa de todos los servicios públicos,","504",NA
"mejoraremos la gestión de los instrumentos de Derecho Público (contratos públicos, gestión presupuestaria, procedimientos administrativos)","303",NA
"e implantaremos mecanismos evaluadores de la eficacia de la actividad administrativa y de los servicios públicos, y de sistemas de exigencia de responsabilidades a los gestores y gestoras.","303",NA
"21. Asesoraremos y apoyaremos a los municipios que pongan en marcha procesos de remunicipalización del servicio del agua y que apuesten por un modelo energético público.","413",NA
"22. Blindaremos el servicio de radio y televisión públicas en el Estatuto de Autonomía para garantizar su independencia,","202.1",NA
"y continuaremos apoyando la reactivación del sector audiovisual valenciano.","502",NA
"23. Trabajaremos por una reforma del Estatuto que amplíe el reconocimiento de derechos de los valencianos y valencianas, en especial los derechos sociales;","201.2",NA
"que incorpore en las instituciones una visión de la democracia más moderna y participativa","202.4",NA
"y que blinde las competencias que ejerce la Generalitat e incorpore otras nuevas, como la gestión de cercanías o la definición de la estructura territorial.","301",NA
"24. Realizaremos un estudio de viabilidad para iniciar una transición de las cuentas de la Generalitat hacia bancos y cooperativas de crédito éticos, que no financien armas y guerras, en coherencia con la Ley de Fomento de la Responsabilidad Social y los Objetivos de Desarrollo Sostenible de Naciones Unidas.","105",NA
"Juventud","H",NA
"La juventud valenciana queremos tener la garantía de poder definir y construir nuestro proyecto vital, individual y colectivo, en igualdad de oportunidades, considerando nuestro origen, situación social y contexto.","706",NA
