"text","cmp_code","eu_code"
"Para responder a este objetivo apostamos por unas políticas de juventud integrales, que nos consideren a las personas jóvenes como sujetos desde todas las dimensiones: educativa, laboral, emancipadora, de ocio y de salud.","706",NA
"Además, estas políticas de juventud deben estar muy coordinadas, suficientemente financiadas, y tienen que ser protagonistas de la agenda de la Generalitat y de todos sus departamentos.","706",NA
"Propuestas","H",NA
"1. Desarrollaremos la Estrategia Valenciana de la Juventud como eje vertebrador de las políticas de juventud de la Generalitat, con el presupuesto necesario para su ejecución.","706",NA
"2. Crearemos un Observatorio de la Juventud en el seno del IVAJ, con capacidad para realizar estudios y conocer la realidad de la juventud valenciana y para orientar las políticas de todas las Conselleries.","706",NA
"3. Integraremos en un único abono de transporte, con tarifa reducida, el uso de las distintas modalidades de transporte público para fomentar su uso,","411",NA
"luchar contra el cambio climático","501",NA
"y garantizar el derecho a la movilidad de la juventud valenciana.","411",NA
"4. Fomentaremos la creación de proyectos empresariales jóvenes, especialmente a través de cooperativas, facilitando la cesión de espacios pú blicos de trabajo compartido y acompañándolos durante todo su proceso de creación y consolidación.","402",NA
"5. Incrementaremos el presupuesto de la línea de ayudas específica para facilitar el acceso de los jóvenes y las jóvenes a una vivienda digna a través del alquiler, estableciendo criterios de renta;","504",NA
"crearemos una red de vivienda pública","504",NA
"y exigiremos un 30% de vivienda de protección oficial en las nuevas promociones y un 7% específico para jóvenes.","504",NA
"6. Ampliaremos los recursos y el personal de la Red Joven y de los Centros de Información Juvenil (CIJ)","504",NA
"y crearemos una mesa entre las entidades juveniles de ocio educativo y el IVAJ.","502",NA
"7. Modificaremos la Ley Orgánica del Régimen Electoral General para establecer el derecho a voto en los 16 años.","202.1",NA
"8. Exigiremos al Gobierno central la modificación del Programa de Garantía Juvenil con una mayor dotación para las políticas activas de empleo de la juventud y una mayor participación en el programa de las comunidades autónomas y de los instrumentos de participación joven.","504",NA
"Feminismos","H",NA
"Vivimos en un momento histórico del feminismo, en el cual las mujeres, a través de las redes y las conexiones globales, están generando un cambio, una revolución que no tiene marcha atrás y que debe impregnarlo todo.","503",NA
"Desde Compromís desarrollaremos las políticas de igualdad, mediante políticas públicas dirigidas a promover la igualdad en todas las políticas y acciones, a todos los niveles y en todas las fases de planificación, ejecución y evaluación.","503",NA
"Haremos especial hincapié en la igualdad laboral.","503",NA
"El empleo y la cultura empresarial tienen que ser los campos de acción para romper tanto la brecha salarial como el techo de cristal y el suelo pegajoso, así como otros elementos que frenan la igualdad en el mundo laboral.","503",NA
"También en el ámbito del lenguaje y los medios.","503",NA
"La comunicación es la forma con la que nos llega la información, por eso hay que incidir en las formas que utilizamos para describir el mundo y sustituir la visión patriarcal por otra igualitaria.","503",NA
"Propostes","H",NA
"1. Impulsaremos una nueva Ley de Igualdad puntera en todo el Estado que garantice la igualdad real entre mujeres y hombres desde una vertiente feminista, transversal e inclusiva para construir una sociedad realmente democrática.","503",NA
"2. Implementaremos un programa de educación afectivo-sexual a las aulas, a partir de los 6 años, como herramienta de prevención de la violencia machista, de fomento de los buenos tratos y de derecho a la sexualidad.","503",NA
"3. Reformaremos la Ley de Igualdad Estatal para garantizar la paridad en los espacios de decisión de todos los ámbitos, incluyendo las grandes empresas.","503",NA
"Además, impulsaremos un nuevo Pacto “Empresa y Género” que incluya la perspectiva de género en la óptica empresarial y laboral con medidas de corresponsabilidad, igualdad salarial y participación de las mujeres en los órganos de decisión.","503",NA
"4. Desarrollaremos una estrategia valenciana para la erradicación de la violencia sexual que incorpore la prostitución como una forma de violencia hacia las mujeres.","503",NA
"5. Desarrollaremos el Pacto Valenciano contra la Violencia de Género y Machista, y lo dotaremos del presupuesto necesario para que sea efectivo.","503",NA
"6. Implementaremos, en tres años de forma progresiva, los permisos iguales, intransferibles e irrenunciables por nacimiento, acogida y adopción hasta las 24 semanas por parte de ambas personas progenitoras.","503",NA
"En el caso de las familias monoparentales, se disfrutará de la suma de los dos permisos.","503",NA
"Además, en el caso de los niños y niñas con diversidad funcional o necesidades especiales se ampliará hasta las 26 semanas.","503",NA
"7. Crearemos un programa específico contra la brecha salarial","503",NA
"y lucharemos contra las formas de precariedad que castigan especialmente a las mujeres.","701",NA
"8. Eliminaremos de la normativa estatal la obligatoriedad de mantener los conciertos educativos a los centros que segregan el alumnado por razón de sexo,","503",NA
"e impulsaremos medidas que fortalezcan la coeducación entre los niños y niñas.","503",NA
